,score,subreddit,title,url
499,0,/r/futurology,"Jamie Dimon testifies about blockchain, cryptocurrency and consumer security",https://youtu.be/cwDVjIRkklU
500,132,/r/futurology,"Travel through wormholes is possible, but slow.",https://phys.org/news/2019-04-wormholes.html
501,118,/r/futurology,"Google Quietly Disbanded Another AI Review Board Following Disagreements -- Panel members in U.K. chafed at lack of information access, authority and independence from Google",https://www.wsj.com/articles/google-quietly-disbanded-another-ai-review-board-following-disagreements-11555250401
502,2,/r/futurology,Q&A with Google DeepMind’s Jane Wang,https://simpleweb.co.uk/qa-with-google-deepminds-jane-wang/
503,4,/r/futurology,Is automation going to destroy jobs in the oilpatch and in Estevan?,https://www.pipelinenews.ca/opinion/columnists/is-automation-going-to-destroy-jobs-in-the-oilpatch-and-in-estevan-1.23792205
504,271,/r/futurology,Israeli scientists 3D print human heart.,https://www.jpost.com/HEALTH-SCIENCE/Israeli-scientists-print-first-3D-heart-586902
505,6,/r/futurology,"Nasa, Elon Musk and SpaceX join forces to tackle apocalypse asteroids",https://metro.co.uk/2019/04/15/nasa-elon-musk-join-forces-tackle-threat-posed-apocalypse-asteroids-9204680/amp/
506,28,/r/futurology,Vassar professor Andrew Tallon revolutionized the use of laser scans to 3D map gothic churches — including the Notre Dame. It would be an incredible remembrance of his work and legacy if it could be reconstructed utilizing his work.,https://news.nationalgeographic.com/2015/06/150622-andrew-tallon-notre-dame-cathedral-laser-scan-art-history-medieval-gothic/
507,4,/r/futurology,Flying cars: automating the skies means playing with our lives,https://theconversation.com/flying-cars-automating-the-skies-means-playing-with-our-lives-115102
508,72,/r/futurology,"How Atlanta plans to get to 100% green energy by 2035. Atlanta’s new green energy plan, approved by the City Council in March, calls for the city to run on 100% renewables by 2035. It’s an ambitious goal: The city currently gets 6% to 8% of its electricity mix from renewable sources.",https://www.pri.org/stories/2019-04-15/how-atlanta-plans-get-100-green-energy-2035
509,188,/r/futurology,"A mission to Alpha Centauri affirms humanity's faith in the future - Only about 4.3 light years away, it is the closest star system to Earth. In 2016, a project was launched to build mini spacecraft, accelerate them to 20 per cent of the speed of light, and reach our neighbours in 20 years.",https://www.newscientist.com/article/mg24232253-000-a-mission-to-alpha-centauri-affirms-humanitys-faith-in-the-future/
510,1383,/r/futurology,A new graphene-based foam is the first material to remain soft and squishy even when it’s subjected to the temperature of liquid helium: –269.15° C. A material that remains pliable at such low temperatures could be used to build devices for use in space.,https://www.sciencenews.org/article/new-graphene-foam-squishy-coldest-temperatures
511,16,/r/futurology,VICE Special Report | The Future of Work - Jobs and Automation in Estonia Clip | HBO,https://www.youtube.com/watch?v=YApuGU65csY
512,17,/r/futurology,"Researchers have designed a new device that creates electricity from falling snow. The first of its kind, this device is inexpensive, small, thin and flexible like a sheet of plastic.",https://newsroom.ucla.edu/releases/best-in-snow-new-scientific-device-creates-electricity-from-snowfall
513,18,/r/futurology,We need a reskilling revolution. Here's how to make it happen,https://www.weforum.org/agenda/2019/04/skills-jobs-investing-in-people-inclusive-growth/
514,55,/r/futurology,'My robot companion has changed my life' - Independent.ie,https://www.independent.ie/life/health-wellbeing/health-features/my-robot-companion-has-changed-my-life-38009121.html
515,2,/r/futurology,"Ship, or submarine?",https://gfycat.com/contentslowbaiji
516,31,/r/futurology,MIT prof: It's more likely we are living in a simulation than not,https://futurism.com/the-byte/mit-living-simulation-hypothesis
517,13,/r/futurology,The Space Review: Rationale for a national “astroelectricity” program,http://www.thespacereview.com/article/3693/1
518,26,/r/futurology,"Earth had a top 3 warmest March on record, climate agencies find. Data shows that the global climate is continuing to warm at an accelerating rate, making it more likely that individual years will set all-time records",https://www.axios.com/earth-top-3-warmest-march-el-nino-4322f599-61ee-4b0b-b694-2f2aed004657.html
519,56,/r/futurology,Senolytics Show Promise Against Alzheimer’s in Mice,https://singularityhub.com/2019/04/15/senolytics-show-promise-against-alzheimers-in-mice/
520,4107,/r/futurology,"After 10,000 years of annual crops, we are watching the incredibly historic birth of PERENNIAL agriculture",https://www.reddit.com/r/Futurology/comments/bd3ocp/after_10000_years_of_annual_crops_we_are_watching/
521,0,/r/futurology,As Brick And Mortar Stores Automate Their Customer Service Suffers,https://www.forbes.com/sites/kalevleetaru/2019/04/15/as-brick-and-mortar-stores-automate-their-customer-service-suffers/#3c5359f1152b
522,49,/r/futurology,"6,034 Amazon Employees Demand Company Climate Change Plan: “Emissions must be cut in half by 2030 from 2010 levels and reach zero by 2050.”",https://cleantechnica.com/2019/04/15/6034-amazon-employees-demand-company-climate-change-plan/
523,41,/r/futurology,"Volkswagen I.D. ROOMZZ concept a self-driving ""lounge on wheels"" - a production model that will launch in China in 2021 that has a mode called “I.D. Pilot Relax” which allows occupants to either recline their seats or face them inward for a “more communicative, lounge-like atmosphere.”",https://www.carsguide.com.au/car-news/volkswagen-id-roomzz-concept-a-self-driving-lounge-on-wheels-74148
524,5,/r/futurology,How Automation Will Change Future Workforces,https://www.newsmax.com/finance/elliotdinkin/automation-future-workforce/2019/04/09/id/910838/
525,31027,/r/futurology,Robot solves a Rubik’s cube in a fraction of a second,https://gfycat.com/necessaryjointflyingfish
526,40,/r/futurology,"'Game of Thrones': Elon Musk Proposes Dragon Wings for SpaceX Starship - “With steel membrane wings like a Dragon, we may be able to lower Starship’s orbital reentry temp to ~1000 degrees C, which would allow the whole surface to be uncooled bare metal”",https://www.inverse.com/article/54899-game-of-thrones-elon-musk-proposes-dragon-wings-for-spacex-starship
527,10,/r/futurology,Is “deep medicine” the cure for our healthcare crisis?,https://www.fastcompany.com/90335168/is-deep-medicine-the-cure-for-our-healthcare-crisis
528,2,/r/futurology,Environmental Thinker Bill McKibben Sounds Warning on Technology,https://www.scientificamerican.com/article/environmental-thinker-bill-mckibben-sounds-warning-on-technology/
529,13,/r/futurology,Next level personal transportation!,https://youtu.be/DeFFrHQxQVc
530,29,/r/futurology,"Psychedelic renaissance: could MDMA help with PTSD, depression and anxiety? As Australia’s first trial for psychedelic therapy for terminally ill patients gets under way, a growing movement says it could also help other conditions",https://www.theguardian.com/science/2019/apr/14/psychedelic-renaissance-could-mdma-help-with-ptsd-depression-and-anxiety
531,1748,/r/futurology,"Cells from a woolly mammoth that died more than 28,000 years ago from the Siberian permafrost have been observed to reactivate inside of mouse egg cells. The achievement shows that biological activity can be induced in the cells of long-dead creatures.",https://gfycat.com/EllipticalDisastrousBanteng
532,34,/r/futurology,"Abundance of information narrows our collective attention span, suggests a new study, which found that our collective attention span is indeed narrowing, and that this effect occurs, not only on social media, but also across diverse domains including books, web searches, movie popularity, and more.",https://www.eurekalert.org/pub_releases/2019-04/tuod-aoi041119.php
533,17,/r/futurology,The discrete-time physics hiding inside our continuous-time world,https://phys.org/news/2019-04-discrete-time-physics-continuous-time-world.html
534,16,/r/futurology,How Amazon Demand Drives Autonomous Truck Tech,https://www.youtube.com/watch?v=vMXivgUGVn8
535,16,/r/futurology,Your next car may be Chinese and electric,https://www.youtube.com/watch?v=3BZ2225OJDg
536,5,/r/futurology,Why We’ll Never All Be Happy Again,https://awealthofcommonsense.com/2019/04/why-well-never-all-be-happy-again/
537,21,/r/futurology,"Congress wants to protect you from biased algorithms, deepfakes, and other bad AI - Only a few legislators really know what they’re talking about, but it’s a start.",https://www.technologyreview.com/s/613310/congress-wants-to-protect-you-from-biased-algorithms-deepfakes-and-other-bad-ai/
538,6,/r/futurology,Retailers Like Walmart Are Embracing Robots – Here’s How Workers Can Tell If They’ll Be Replaced,https://www.govtech.com/workforce/Retailers-Like-Walmart-Are-Embracing-Robots-Heres-How-Workers-Can-Tell-If-Theyll-Be-Replaced.html
539,7,/r/futurology,"Inflatable Robots Are Destined for Space, If We Can Control Them",https://spectrum.ieee.org/automaton/robotics/robotics-hardware/inflatable-robots-for-space
540,13,/r/futurology,"A critical flaw in Switzerland's e-voting system is a microcosm of everything wrong with e-voting, security practice, and auditing firms",https://boingboing.net/2019/03/13/principal-agent-problems.html
541,5,/r/futurology,Retailers are embracing robots – here’s how workers can tell if they’ll be replaced,https://www.bizjournals.com/boston/news/2019/04/15/retailers-are-embracing-robots-here-s-how-workers.html
542,11,/r/futurology,Europe looks to remold internet with new copyright rules,https://apnews.com/b2e792464c12490bb66742a999835043
543,14,/r/futurology,AI Developed a Whole New Sport: Speedgate,https://www.engadget.com/2019/04/15/ai-sport-speedgate/
544,4,/r/futurology,What robots and AI may mean for university lecturers and students,http://theconversation.com/what-robots-and-ai-may-mean-for-university-lecturers-and-students-114383
545,13,/r/futurology,Starbucks and Cypress Creek Solar Farms Team Up to Power 360 Stores in Texas,https://stories.starbucks.com/press/2019/starbucks-and-cypress-creek-solar-farms-team-up-to-power-360-stores-in-texas/
546,33,/r/futurology,More than 20 former fire and emergency chiefs from multiple states and territories say Australia is unprepared for worsening natural disasters from climate change and governments are putting lives at risk.,https://www.google.com/amp/s/amp.theguardian.com/australia-news/2019/apr/09/former-fire-chiefs-warn-australia-unprepared-for-escalating-climate-threat
547,19,/r/futurology,SpaceX tapped to launch NASA asteroid deflection mission: DART will lift off atop a Falcon 9 rocket in June 2021 – the first step on a voyage intended to demonstrate how a spacecraft collision can alter the trajectory of an asteroid.,https://newatlas.com/spacex-nasa-asteroid-deflection-mission/59288/
548,10,/r/futurology,"Stem cell therapy clinics are big business in Spokane area, but are desperate patients being sold snake oil?",http://www.spokesman.com/stories/2019/apr/14/stem-cell-therapy-clinics-are-big-business-but-are/
549,3,/r/futurology,The Twilight of Combustion Comes for Germany's Empire of Engines - The nation that invented the heart of the car at the dawn of the 20th century might struggle to adapt to the coming electric era.,https://www.bloomberg.com/features/2019-bmw-electric-car-german-engines/
550,5,/r/futurology,The Robots That Manage the Managers,https://www.wsj.com/articles/the-robots-that-manage-the-managers-11555336904
551,5,/r/futurology,Giant Eagle will bring robots into select stores | ZDNet,https://www.zdnet.com/article/giant-eagle-to-bring-robots-into-some-stores/
552,0,/r/futurology,Innovation Pipeline with Prof. Steve Masiclat | ARK Invest Podcast,https://www.youtube.com/watch?v=Mbye4rnt2Vw
553,7,/r/futurology,VW says China to become global software development hub to autonomous tech,https://www.reuters.com/article/us-autoshow-shanghai-volkswagen-software/vw-says-china-to-become-global-software-development-hub-to-autonomous-tech-idUSKCN1RR16S
554,23,/r/futurology,"Health system needs to be protected from climate change: Australia were already running close to the line, and did not have enough wiggle-room to deal with increasing problems linked to climate change.",https://www.smh.com.au/national/queensland/health-system-needs-to-be-protected-from-climate-change-doctors-20190415-p51edz.html
555,145,/r/futurology,"There was a moment, about 20 years ago, when farmers thought that they'd finally defeated weeds forever. Now more and more varieties of weeds are being discovered with resistance to weedkillers, representing a challenge to modern agriculture.",https://www.npr.org/sections/thesalt/2019/04/11/710229186/as-weeds-outsmart-the-latest-weedkillers-farmers-are-running-out-of-options
556,4,/r/futurology,"Kardashev Type 0.6 vs 1 and Maximum Output of Each Energy Source [Sept 11, 2018]",https://www.reddit.com/r/Futurology/comments/bdj2gp/kardashev_type_06_vs_1_and_maximum_output_of_each/
557,62,/r/futurology,"OpenAI Five defeats professional Dota 2 team, twice",https://venturebeat.com/2019/04/13/openai-five-defeats-a-team-of-professional-dota-2-players/
558,10,/r/futurology,Chinese scientist defends splicing human brain gene into monkeys,https://futurism.com/the-byte/scientist-defends-monkeys-human-gene
559,6,/r/futurology,Can artificial intelligence help end fake news?,https://horizon-magazine.eu/article/can-artificial-intelligence-help-end-fake-news.html#.XLSGTkyMdmc.reddit
560,3,/r/futurology,Robotics & AI newsletter search,https://www.reddit.com/r/Futurology/comments/bdjcw8/robotics_ai_newsletter_search/
561,0,/r/futurology,INTRODUCING: The 10 people transforming healthcare (Business Insider),https://www.businessinsider.com/people-transforming-healthcare-2019-4
562,8,/r/futurology,"Automation helping to cut costs, stirring debate over effect on jobs",http://www.news-gazette.com/news/2019-04-14/automation-helping-cut-costs-stirring-debate-over-effect-jobs.html
563,39,/r/futurology,"Millennials are the demographic most open to self-driving cars, but not by much - almost 50% of millennials believe self-driving cars are a good idea.",https://bgr.com/2019/04/14/future-of-self-driving-cars-millennials-study/
564,47,/r/futurology,"Startup Nikola Bets Hydrogen Will Finally Break Through With Big Rigs. ""The 4-year-old maker of H2 tractor trailers is extolling a vision as brash as the one Tesla’s founders unveiled 13 years ago with its pricey all-electric cars: Nikola will act as a catalyst to bring hydrogen to the mainstream""",https://www.forbes.com/sites/alanohnsman/2019/04/14/can-a-15-billion-bet-on-fuel-cell-big-rigs-be-a-game-changer-for-hydrogen/
565,1,/r/futurology,Council Post: Five Industries Being Transformed By Artificial Intelligence,https://www.forbes.com/sites/forbesagencycouncil/2019/04/15/five-industries-being-transformed-by-artificial-intelligence/
566,0,/r/futurology,How Automation Will Influence The Job Market for Women,https://www.shethepeople.tv/top-stories/issues/automation-women-oriented-jobs
567,0,/r/futurology,VW says China to become global software development hub to autonomous tech,https://www.reuters.com/article/us-autoshow-shanghai-volkswagen-software-idUSKCN1RR16S
568,28,/r/futurology,Saving the future of our planet - By David Attenborough,https://www.ourplanet.com/en/video/how-to-save-our-planet
569,41,/r/futurology,Scientist insert human MCPH1 gene (a gene in human brain development and brain evolution) into rhesus monkeys to test monkey's cognitive skills improvement,https://academic.oup.com/nsr/advance-article/doi/10.1093/nsr/nwz043/5420749
570,15100,/r/futurology,Boston Dynamics robotics improvements over 10 years,https://gfycat.com/DapperDamagedKoi
571,0,/r/futurology,Women Will Face Disproportionately Negative Consequences from AI,https://www.thenation.com/article/women-artificial-intelligence-technology/
572,54,/r/futurology,"Protests and purchasing power could be positive tipping points in climate change. In the socio-economic world, “good” tipping points would be ones that might induce corporations and individuals to rapidly increase activities that help prevent climate change",https://cosmosmagazine.com/climate/protests-and-purchasing-power-could-be-positive-tipping-points-in-climate-change
573,4017,/r/futurology,South Korea once recycled 2% of its food waste. Now it recycles 95%,https://www.weforum.org/agenda/2019/04/south-korea-recycling-food-waste/
574,21,/r/futurology,How Amazon Demand Drives Autonomous Truck Tech,https://youtu.be/vMXivgUGVn8
575,14,/r/futurology,Government document details communities where workers may face greatest automation risk,https://www.ctvnews.ca/business/government-document-details-communities-where-workers-may-face-greatest-automation-risk-1.4379388
576,13,/r/futurology,A.I. Bias Isn’t the Problem. Our Society Is,http://fortune.com/2019/04/14/ai-artificial-intelligence-bias/
577,9,/r/futurology,Startup Nikola Bets Hydrogen Will Finally Break Through With Big Rigs,https://www.forbes.com/sites/alanohnsman/2019/04/14/can-a-15-billion-bet-on-fuel-cell-big-rigs-be-a-game-changer-for-hydrogen/#31a72ecbfe4c
578,2,/r/futurology,How does 5G work and when will you be able to use it?,https://youtu.be/T0_o6__2gRI
579,25,/r/futurology,Getting (almost) all our energy from the sun by 2050- A 100% renewable energy system could also create 22 million solar jobs by 2050,https://www.pv-magazine.com/2019/04/12/getting-almost-all-our-energy-from-the-sun-by-2050/
580,92,/r/futurology,"David Attenborough, the voice of Our Planet: “Things are going to get worse” - The voice of some of the most stunning nature documentaries ever made is pessimistic about the future of wildlife on earth.",https://www.vox.com/2019/4/12/18306566/david-attenborough-our-planet-netflix-advocacy
581,9,/r/futurology,Picking a career through a framework of future dystopia,https://www.reddit.com/r/Futurology/comments/bd8qs0/picking_a_career_through_a_framework_of_future/
582,36392,/r/futurology,Falcon Heavy's boosters landing in Cape Canaveral,https://gfycat.com/bigadorabledikkops
583,4,/r/futurology,Demystifying AI and Machine Learning: What You Need to Know,https://www.youtube.com/watch?v=hlEzVgKzZ3w
584,42,/r/futurology,2020 candidate Andrew Yang unveils plans to campaign remotely using a 3D hologram,https://www.theverge.com/2019/4/12/18307776/3d-hologram-andrew-yang-democratic-candidate-battleground-states-primary-elections-2020
585,61,/r/futurology,"Scientists have developed a new type of gene editing CRISPR system, called CRISPR-Cas3, which can efficiently erase long stretches of DNA from a targeted site in the human genome, with the potential to seek out and erase such ectopic viruses as herpes simplex, Epstein-Barr, and hepatitis B.",http://news.cornell.edu/stories/2019/04/crispr-cas3-innovation-holds-promise-disease-cures-advancing-science
586,20,/r/futurology,A smart solution to vision problems: Smartphone apps and peripherals that simplify the diagnosis of sight problems could help doctors to reach the 2.5 billion people with poor vision living in low-income countries,https://www.nature.com/articles/d41586-019-01110-z
587,0,/r/futurology,The dissolution of Masculinity and Femininity,https://www.reddit.com/r/Futurology/comments/bdfbz9/the_dissolution_of_masculinity_and_femininity/
588,28,/r/futurology,"World’s biggest airplane takes flight for the first time ever - It was a critical first test flight for the aircraft, designed to launch rockets into orbit from the air. The inaugural flight lasted for 150 minutes, according to the company, after which the plane safely landed.",https://www.theverge.com/transportation/2019/4/13/18309129/stratolaunch-worlds-biggest-airplane-first-flight-rockets
589,14,/r/futurology,This Ex-Tesla Engineer Wants to Change Aviation | CNBC,https://youtu.be/Nh4w25br1uM
590,27,/r/futurology,Mars Colony: A City on Mars Could Descend Into Cabin Fever and Nationalism - Calling for an astrosociological approach: “You can’t just throw a group of people in an isolated environment without any kind of structure”,https://www.inverse.com/article/54813-mars-colony
591,4,/r/futurology,New program seeks to train workers for industrial automation,https://weartv.com/news/local/new-program-seeks-to-train-workers-for-industrial-automation
592,3,/r/futurology,Cow-milking robots the new face of dairy farming,https://www.thenational.ae/business/technology/cow-milking-robots-the-new-face-of-dairy-farming-1.848757
593,57,/r/futurology,Longshot presidential candidate Andrew Yang thinks rogue geoengineering could cause a war. He wants the US to take the lead before it happens.,https://amp.businessinsider.com/andrew-yang-thinks-geoengineering-could-lead-to-war-2019-4
594,33,/r/futurology,"Ikea will start renting and recycling furniture worldwide as part of an eco-friendly drive to address concerns its affordable, flat-pack business model leads to overconsumption and waste.",https://www.thelocal.se
595,12,/r/futurology,Google has opened its first Africa Artificial Intelligence lab in Ghana,https://edition.cnn.com/2019/04/14/africa/google-ai-center-accra-intl/index.html?
596,29,/r/futurology,Renewables will supply nearly half of UK electricity by 2025,https://pbs.twimg.com/media/D39gKo2WwAADwXe.png
597,10,/r/futurology,DeepMind: The Hanabi Card Game Is the Next Frontier for AI Research,https://www.youtube.com/watch?v=cD-eXjf854Q
598,9,/r/futurology,"Podcast with Gray Newell on Brain Interfacing - ""We are much further along than people think""",https://www.youtube.com/watch?v=35QvyaRn6OY
599,14,/r/futurology,"The organ shortage will soon get worse. Animal organs could help. ""It’s no longer a question of if. It’s just a question of when.""",https://futurism.com/organ-shortage-worse-animal-organs
600,33,/r/futurology,Australia's top Great Barrier Reef officials warn the natural wonder will virtually collapse if the planet becomes 1.5 degrees hotter – a threshold that scientists say requires shutting down coal within three decades.,https://www.smh.com.au/federal-election-2019/radical-climate-action-critical-to-great-barrier-reef-s-survival-government-body-says-20190413-p51dul.html
601,11,/r/futurology,Maple Leaf embracing meatless alternatives as plant-based protein goes ‘mainstream’,https://business.financialpost.com/news/retail-marketing/maple-leaf-foods-diving-deeper-into-plant-based-protein-with-us310-million-factory
602,13,/r/futurology,World’s first robot-operated number plates facility opened in Dubai - The facility can produce 33 thousand plates per day,https://gulfnews.com/uae/transport/worlds-first-robot-operated-number-plates-facility-opened-in-dubai-1.1555142634495
603,9,/r/futurology,"Pepsi Co plan to ""hang"" giant ad over the night sky with Cubesats",https://futurism.com/pepsi-orbital-billboard-night-sky/
604,19,/r/futurology,"Japan's population decline accelerates despite record immigration, could hit 50 million in 100 years",https://www.ft.com/content/29d594fa-5cf2-11e9-9dde-7aedca0a081a
605,17,/r/futurology,Seychelles president issues underwater plea to protect oceans - gives speech from submersible 120 metres below the surface of Indian Ocean. About 5% of the world’s oceans are protected. Countries have agreed to increase the area to 10% by 2020.,https://www.theguardian.com/world/2019/apr/14/seychelles-president-danny-faure-underwater-plea-protect-oceans
606,12,/r/futurology,Emissions fall in Madrid city center thanks to new traffic restrictions - The level of nitrogen oxide has dropped by 38% after local authorities made 472 hectares off-limits to most vehicles at the end of November,https://elpais.com/elpais/2019/03/14/inenglish/1552556189_425975.html
607,1,/r/futurology,FDA AI Challenge: How To Assess Safety And Effectiveness : Shots,https://www.npr.org/sections/health-shots/2019/04/14/711775543/how-can-we-be-sure-artificial-intelligence-is-safe-for-medical-use
608,0,/r/futurology,Why Facial Recognition Is So Creepy | Untangled,https://www.youtube.com/watch?v=BqQT4sIOYA0
609,4,/r/futurology,NASA Twins Study Provides New Insight Into How Space Travel Affects Human Health,https://singularityhub.com/2019/04/14/nasa-twins-study-provides-new-insight-into-how-space-travel-affects-human-health/
610,6,/r/futurology,Are we ready for the robot revolution?,https://www.toledoblade.com/opinion/editorials/2019/04/14/are-we-ready-robot-revolution-automation-toledo/stories/20190412109
611,8,/r/futurology,"Delivery robots are poised to invade our cities, but are we ready for them? | Digital Trends",https://www.digitaltrends.com/cool-tech/smart-cities-delivery-robots/
612,16,/r/futurology,Are humane prisons the future of imprisonment?,https://youtu.be/5v13wrVEQ2M
613,4,/r/futurology,Transitioning to Cyborg,https://link.medium.com/TWweuF4FSV
614,58,/r/futurology,OpenAI’s Dota 2 AI steamrolls world champion e-sports team with back-to-back victories,https://www.theverge.com/2019/4/13/18309459/openai-five-dota-2-finals-ai-bot-competition-og-e-sports-the-international-champion
615,4,/r/futurology,How to knit a sports car.,https://www.economist.com/science-and-technology/2019/04/13/how-to-knit-a-sports-car-with-carbon-fibre
616,56,/r/futurology,"Human Brain/Cloud Interface: US researchers predict that exponential progress in nanotechnology, nanomedicine, AI, and computation will lead this century to the development of a ""Human Brain/Cloud Interface"" (B/CI), that connects brain cells to vast cloud-computing networks in real time.",https://www.frontiersin.org/articles/10.3389/fnins.2019.00112/full
