,score,subreddit,title,url
162,15,/r/futurology,Boston Dynamics' four-legged Spot robots hot off the production line! | What the Future,https://www.youtube.com/watch?v=1dHNXykSP2I
163,64,/r/futurology,Cities and countries aim to slash plastic waste within a decade. Global and local community leaders from more than 170 countries have pledged to “significantly reduce” the amount of single-use plastic products by 2030.,https://theconversation.com/cities-and-countries-aim-to-slash-plastic-waste-within-a-decade-114790
164,7,/r/futurology,How much are we sacrificing for automation?,https://www.fastcompany.com/90336550/how-much-are-we-sacrificing-for-automation
165,3,/r/futurology,Reasons Why You should Integrate AI and ML in Your Existing Business App,http://customerthink.com/reasons-why-you-should-integrate-ai-and-ml-in-your-existing-business-app/
166,2,/r/futurology,Will we ever have robot carers?,http://www.bbc.com/future/story/20190418-will-we-ever-have-robot-carers?ocid=global_future_rss
167,60,/r/futurology,"How CRISPR Gene Editing Trials on Humans Were Finally Approved in the US - In the wake of CRISPR controversy, American scientists forge ahead cautiously.",https://www.inverse.com/article/55072-crispr-clinical-trials-pennsylvania
168,17,/r/futurology,Locating solar panels which always face the sun like sun flower. Netherlands,https://youtu.be/chPlBy2rtKA
169,53,/r/futurology,Costa Rica bets on ending fossil fuel use by 2050 - The aim is to have 70 percent of public transport powered by electricity in 2035—and the whole fleet by 2050.,https://phys.org/news/2019-04-costa-rica-fossil-fuel.html
170,56,/r/futurology,"The private frontier: corporate space explorers stand by for a $1tn lift-off - new US government moonshot would be a big boost to the already burgeoning private space industry, which is forecast to triple in scale over the next 20 years. “Space Race 2.0” will make the industry worth $2.7tn by 2045.",https://www.theguardian.com/science/2019/apr/20/space-explorers-trillion-dollar-lift-off-private-frontier
171,7,/r/futurology,[Question] Reversing the cable-ization of internet streaming,https://www.reddit.com/r/Futurology/comments/bfvyuy/question_reversing_the_cableization_of_internet/
172,4,/r/futurology,Can emotions be measured?,https://www.reddit.com/r/Futurology/comments/bfwio8/can_emotions_be_measured/
173,5,/r/futurology,AI threat sees education fund doubled for Hong Kong workers,https://www.scmp.com/news/hong-kong/education/article/3007071/threat-artificial-intelligence-sees-hong-kong-education
174,11,/r/futurology,"In Travel Insurance, Machine Learning Is Turning Conventional Wisdom On Its Head",https://www.forbes.com/sites/christopherelliott/2019/04/21/in-travel-insurance-machine-learning-is-turning-conventional-wisdom-on-its-head/#78e6e5394eb7
175,0,/r/futurology,I just had a maybe good idea,https://www.reddit.com/r/Futurology/comments/bg1qx0/i_just_had_a_maybe_good_idea/
176,595,/r/futurology,We’re altering the climate so severely that we’ll soon face apocalyptic consequences. Here are 9 last-ditch ways we could hack the planet to reverse that trend.,https://www.businessinsider.com/geoengineering-how-to-reverse-climate-change-2019-4
177,56928,/r/futurology,"Gravity Industries' $440,000 jet suit.",https://gfycat.com/KaleidoscopicShrillDragonfly
178,519,/r/futurology,Jennifer Doudna: We will eat the first Crispr'd food In 5 years,https://www.thisisinsider.com/first-crispr-food-5-years-berkeley-scientist-inventor-2019-4
179,0,/r/futurology,Getting Banks to Latch onto Blockchain,https://www.gsb.stanford.edu/insights/getting-banks-latch-blockchain
180,12,/r/futurology,What You Must Understand About Solar Power,https://www.tipsclear.com/about-solar-power-what-you-must-understand/
181,33,/r/futurology,Virtual clothes to save the planet: ethical consumerism in the future. Consumers will move away from conspicuous consumption which is increasingly seen as unethical and unsustainable.,https://www.theage.com.au/national/queensland/virtual-clothes-to-save-the-planet-ethical-consumerism-in-the-future-20190329-p5192w.html
182,30,/r/futurology,Researchers use gene editing with CRISPR to treat lethal lung diseases before birth in an animal model in which a harmful mutation causes death within hours after birth. This proof-of-concept study shows that in utero editing could be a promising new approach for treating lung diseases before birth.,https://www.chop.edu/news/researchers-use-gene-editing-crispr-treat-lethal-lung-diseases-birth
183,11,/r/futurology,Taking biomedical 3D printing to the next level is a near future possibility with this heart printed with stem cells,https://www.nbcnews.com/mach/science/israeli-scientists-create-world-s-first-3d-printed-heart-using-ncna996031
184,20,/r/futurology,"We'll be eating the first Crispr'd foods within 5 years, according to a geneticist who helped invent the blockbuster gene-editing tool",https://www.businessinsider.com/first-crispr-food-5-years-berkeley-scientist-inventor-2019-4?r=US&IR=T
185,0,/r/futurology,"Why aren't cars made out of a safer, bouncier material to lower car accident fatalities?",https://www.reddit.com/r/Futurology/comments/bg30js/why_arent_cars_made_out_of_a_safer_bouncier/
186,4,/r/futurology,Genetic risk score developed for obesity: newly developed tool can assess a person’s risk for becoming obese based on genetic variants at more than 2 million loci in the genome. Potential implications for targeted healthcare in an increasingly obesogenic environment.,https://www.the-scientist.com/news-opinion/genetic-risk-score-developed-for-obesity-65762
187,9,/r/futurology,BYD is going from buses to exotic supercars — all EVs - Autoblog,https://www.autoblog.com/2019/04/20/byd-e-seed-gt-ev-shanghai/
188,8,/r/futurology,AI for eCommerce and Marketing,https://myblvd.com/2019/03/22/using-ai-for-marketing-and-ecommerce/
189,10,/r/futurology,"As We Democratize Biology, We Must Avoid Biologizing Democracy",https://singularityhub.com/2019/04/21/as-we-democratize-biology-we-must-avoid-biologizing-democracy/
190,16,/r/futurology,"The hydrogen fuel strategy behind Nikola’s truck dream. Water electrolysis, not methane reformation, will drive heavy-duty refueling plan.",https://arstechnica.com/cars/2019/04/the-hydrogen-fuel-strategy-behind-nikolas-truck-dream/
191,546,/r/futurology,"Governments around the world must fully protect 30% of Earth’s surface and sustainably manage another 20% by 2030 if they’re to have a hope of saving ecosystems and limiting global warming, researchers have said in a new report.",https://www.nature.com/articles/d41586-019-01253-z
192,1,/r/futurology,Forecasting the Next Recession: How Severe Will the Next Recession Be? The recession could come as early as first half of 2020 but may not be as severe as past recessions.,https://www.guggenheiminvestments.com/perspectives/macroeconomic-research/recession-update-how-severe-will-recession-be
193,8,/r/futurology,"The Arctic present, with all its uncanniness, is likely to be the future everywhere. Even 13 years ago, in 2006, the region was two degrees Celsius warmer than the historical average and was experiencing anomalies. Now it’s warming twice as fast.",https://www.bostonglobe.com/ideas/2019/04/20/the-arctic-present-with-all-its-uncanniness-likely-future-everywhere/mAXxGJqxy2Ue7dlhyX9N6K/story.html
194,12,/r/futurology,Publisher Releases First Textbook Written Entirely by an Algorithm,https://www.smithsonianmag.com/smart-news/publisher-releases-first-textbook-written-entirely-algorithm-180971986/
195,8,/r/futurology,"Study finds global action needed to ensure acceptable climate futures. Researchers studied population growth, the cost of carbon-free technologies, and the climate's sensitivity to greenhouse gas emissions—and examined 5.2 million future samples from these uncertainties.",https://news.psu.edu/story/569492/2019/04/16/research/study-finds-global-action-needed-ensure-acceptable-climate-futures
196,13,/r/futurology,What would a post silicone world look like?,https://www.reddit.com/r/Futurology/comments/bfmcan/what_would_a_post_silicone_world_look_like/
197,5,/r/futurology,Is the Internet hollowing out the middle class?,http://gerrymcgovern.com/is-the-internet-hollowing-out-the-middle-class/
198,31,/r/futurology,Commentary: Are you prepared to be replaced by robots? Some at Walmart soon have to be,https://www.channelnewsasia.com/news/commentary/automation-threaten-jobs-walmart-replace-workers-with-robots-11450482
199,7,/r/futurology,Why would we trust cultured meat? Max Elder from the Institute for the Future describes why we have trust in foods.,https://youtu.be/cfFyyNTJceU
200,6,/r/futurology,Could smartphones be docked to a TV to turn them into desktop computers? ..Similar to a Nintendo switch,https://www.reddit.com/r/Futurology/comments/bfmfot/could_smartphones_be_docked_to_a_tv_to_turn_them/
201,28,/r/futurology,"With Driverless Cars Running Late, a Startup Tries Remote-Control Trucks",https://www.bloomberg.com/news/articles/2019-04-18/phantom-auto-expands-remote-driving-to-trucks-forklifts
202,0,/r/futurology,Why haven’t we evolved a solution to aging?,https://www.fastcompany.com/90336230/why-hasnt-evolution-dealt-with-the-illnesses-of-aging
203,0,/r/futurology,The Price of Universal Basic Income,https://www.jamesallan.net/blog/universal-basic-income
204,47557,/r/futurology,2/3 of U.S. voters say 100% renewable electricity by 2030 is important,https://pv-magazine-usa.com/2019/04/19/2-3-of-u-s-voters-say-100-renewable-electricity-by-2030-is-important/
205,0,/r/futurology,Humanity is halfway done,https://www.reddit.com/r/Futurology/comments/bfung2/humanity_is_halfway_done/
206,6,/r/futurology,11 ways we could geoengineer the planet to reverse climate change,https://www.businessinsider.com/geoengineering-how-to-reverse-climate-change-2019-4
207,10,/r/futurology,If AI is truly the next step in evolution then what does that mean for us?,https://www.reddit.com/r/Futurology/comments/bfij4y/if_ai_is_truly_the_next_step_in_evolution_then/
208,98,/r/futurology,"A Mars Colony Could Be Humanity's First Shot at a Ground-Up, Pure Economy - “To an economist, this is perhaps the most exciting thing about space settlement!”",https://www.inverse.com/article/55060-a-mars-colony-could-be-humanity-s-best-shot-at-a-purely-designed-economy
209,28,/r/futurology,My way or the Huawei: how US ultimatum fell flat in Southeast Asia,https://www.scmp.com/week-asia/geopolitics/article/3006961/my-way-or-huawei-how-us-ultimatum-over-chinas-5g-giant-fell
210,42,/r/futurology,Mapping the world in 3D will let us paint streets with augmented reality,https://www.technologyreview.com/s/613311/mapping-the-world-in-3d-will-let-us-paint-streets-with-augmented-reality/
211,10,/r/futurology,The Offensive Remark. A fictional story about a fictional news event. Michael Callow,https://www.reddit.com/r/Futurology/comments/bfhchs/the_offensive_remark_a_fictional_story_about_a/
212,21,/r/futurology,Editing Our DNA with CRISPR: The Promise and Peril of Rewriting Life,https://www.youtube.com/watch?v=KRlJzNj6k3E
213,9,/r/futurology,Robot Dogs Pull Truck,https://www.reddit.com/r/Futurology/comments/bfesmu/robot_dogs_pull_truck/
214,25,/r/futurology,Amazon demands selfies from delivery drivers,https://www.businessinsider.com/amazon-demands-selfies-from-delivery-drivers-2019-4
215,32,/r/futurology,"Amazon Cozies Up to Oil & Gas, While Lagging Peers on Renewables",https://www.greentechmedia.com/articles/read/amazon-cozies-up-to-oil-gas-while-lagging-peers-on-renewables
216,71,/r/futurology,"World’s Largest Concentrated Solar Power Plant - The solar power plant will cover 3,750 hectares- i.e. equivalent to 4,500 football fields. The solar park as a whole is expected to produce five gigawatts when completed.",https://www.sciencetimes.com/articles/20374/20190419/world-s-largest-concentrated-solar-power-plant.htm
217,976,/r/futurology,Puerto Rico to Adopt 100% Renewable Energy - The Rising,https://therising.co/2019/04/17/puerto-rico-to-adopt-renewable-energy/
218,54,/r/futurology,"Returning to the moon for rocket fuel and clean energy - Helium-3 is the only mineral that might be economical to return to Earth. Helium-3-fueled fusion would unlock a limitless, pollution-free power source that does not emit greenhouse gasses.",https://thehill.com/opinion/technology/439692-returning-to-the-moon-for-rocket-fuel-and-clean-energy
219,26,/r/futurology,"Cornell scientists create ‘living’ machines that eat, grow, and evolve. These human-engineered organic machines are capable of locomotion, consuming resources for energy, growing and decaying, and evolving. Eventually they die.",https://thenextweb.com/robots/2019/04/19/cornell-scientists-create-living-machines-that-eat-grow-and-evolve/
220,40,/r/futurology,"A paper published in Science today outlines a new “Global Deal for Nature,” officially launching an effort to establish science-based conservation targets covering all of planet Earth, including terrestrial, freshwater, and marine ecosystems.",https://news.mongabay.com/2019/04/new-paper-proposes-a-science-based-global-deal-for-nature/
221,6,/r/futurology,Exclusive: Fuel cells and H2 'game changing' technologies,https://www.gasworld.com/exclusive-fuel-cells-and-hydrogen-game-changer/2017037.article
222,12,/r/futurology,A realistic article on the future of electrical vehicles.,https://www.economist.com/business/2019/04/17/big-carmakers-are-placing-vast-bets-on-electric-vehicles
223,23,/r/futurology,"Solar Energy Overtakes Fossil Fuels. “By 2050 wind and solar technology provide almost 50% of total electricity globally - ‘50 by 50’ - with hydro, nuclear and other renewables taking total zero-carbon electricity up to 71%.”",https://www.altenergymag.com/news/2019/04/18/solar-energy-overtakes-fossil-fuels-green-solar-founder-nicki-zvik-comments/30795/
224,4,/r/futurology,This Week’s Awesome Stories From Around the Web (Through April 20),https://singularityhub.com/2019/04/20/this-weeks-awesome-stories-from-around-the-web-through-april-20/
225,29,/r/futurology,West Virginia Will Use Blockchain Voting in the 2020 Presidential Election,https://www.longhash.com/news/west-virginia-will-use-blockchain-voting-in-the-2020-presidential-election-why
226,12,/r/futurology,"This Quantum Computer Can See the Futures - At least, 16 possible versions of it — all at the same time.",https://www.livescience.com/65271-quantum-computer-sees-16-futures.html
227,941,/r/futurology,Machine learning is giving retro games cutting-edge graphics,https://futurism.com/machine-learning-making-retro-games-new
228,5114,/r/futurology,Elon Musk said Tesla cars will probably be better than humans at driving by the end of 2019,https://www.businessinsider.com/elon-musk-predicts-tesla-cars-better-than-humans-at-driving-by-end-of-2019-2019-4?nr_email_referer=1&utm_source=Sailthru&utm_medium=email&utm_content=Tech_select
229,16,/r/futurology,What if nuclear just needs a rebranding?,https://www.reddit.com/r/Futurology/comments/bf72x3/what_if_nuclear_just_needs_a_rebranding/
230,51,/r/futurology,Renewables are pulling ahead in formerly coal-heavy states. At least 36 gigawatts (GW) of the country's 260 GW of existing coal generation are forecast to close by 2024,https://www.axios.com/renewables-are-pulling-ahead-in-formerly-coal-heavy-states-65546b59-c3f3-4ebb-b7b5-5a5a84dc4af9.html
231,30,/r/futurology,"'We Will Win:' OpenAI's 'Dota 2' Team Is Crushing Humans Online, But Players Are Not Giving Up - 'The bots are locked. They are not learning, but we humans are. We will win.'",https://motherboard.vice.com/en_us/article/8xzaeg/we-will-win-openais-dota-2-team-is-crushing-humans-online-but-players-are-not-giving-up
232,66,/r/futurology,I'm Vox reporter David Roberts. AMA about my recent reporting on Barcelona's superblocks and the future of urban sustainability.,https://www.reddit.com/r/Futurology/comments/bf1i8y/im_vox_reporter_david_roberts_ama_about_my_recent/
233,45,/r/futurology,"New York City Seeks To Reduce Carbon Emissions From Buildings By 40%. At present, 67% of all greenhouse gas emissions in New York City come from buildings",https://cleantechnica.com/2019/04/19/new-york-city-seeks-to-reduce-carbon-emissions-from-buildings-by-40/
234,130,/r/futurology,"UBI: 170K Young Koreans Will Get $883 to Spend Locally - A radical new scheme plans to give 24-year-olds in one South Korean province a universal basic income with hardly any conditions, which advocates argue would provide recipients with a guaranteed safety net to protect against A.I. and robotics.",https://www.inverse.com/article/54988-universal-basic-income-24-year-old-koreans-will-get-money-to-spend-locally
235,6,/r/futurology,"Drones, supercomputers and sonar deployed against floods",https://www.apnews.com/c3aed04fe2614685817026dc2507ed4d
236,3,/r/futurology,Predict The Future: Ηas already been achieved using computers (2019),https://frontnet.eu/predict-the-future-%ce%b7as-already-been-achieved-using-computers-2019/
237,2,/r/futurology,When will we discover the faster-than-light travel technology?,https://www.reddit.com/r/Futurology/comments/bfc19i/when_will_we_discover_the_fasterthanlight_travel/
238,43,/r/futurology,Dubai to build the world’s largest concentrated solar power plant,https://bigthink.com/technology-innovation/dubai-solar-power?utm_medium=Social&utm_source=Facebook&fbclid=IwAR04WLaBZcVd-zDRGEdYtCMko8AJ5ugKm_DAScoFG_s0gS76Vz4FtZriTds#Echobox=1555621681
239,59944,/r/futurology,"A wave of satellites set to orbit the Earth will be able to pinpoint producers of greenhouse gases, right down to an individual leak at an oil rig. They are looking to track nations, industries, companies and even individual facilities",https://www.insurancejournal.com/news/international/2019/04/18/524208.htm
240,4,/r/futurology,Portugal is betting on artificial intelligence to boost exports,https://www.weforum.org/agenda/2019/04/portugal-bets-on-artificial-intelligence-to-boost-exports/
241,10,/r/futurology,The Demography of the World Population from 1950 to 2100,https://pbs.twimg.com/media/D4cnN8uWAAAFuju.jpg
242,56,/r/futurology,"FBI’s Facial Recognition Programs Under Fire Over Privacy, Accuracy Concerns",https://www.nextgov.com/emerging-tech/2019/04/fbis-facial-recognition-programs-under-fire-over-privacy-accuracy-concerns/156409/
243,8,/r/futurology,AI as a job saver? Why Japan's auto industry is embracing Industry 4.0 | ZDNet,https://www.zdnet.com/article/ai-as-a-job-saver-why-japans-auto-industry-is-embracing-industry-4-0/
244,21,/r/futurology,46 Corporations Working On Autonomous Vehicles,https://www.cbinsights.com/research/autonomous-driverless-vehicles-corporations-list/
245,23,/r/futurology,The Era of Electric Airplanes is Here,https://edgy.app/electric-airplanes-are-here
246,51,/r/futurology,A neural network can read scientific papers and render a plain-English summary,https://techxplore.com/news/2019-04-neural-network-scientific-papers-plain-english.html
247,18,/r/futurology,Powerful CRISPR cousin accidentally mutates RNA while editing DNA target,https://www.sciencemag.org/news/2019/04/powerful-crispr-cousin-accidentally-mutates-rna-while-editing-dna-target
248,8,/r/futurology,Have You tried the Tap Strap Keyboard? Might be perfect for VR,https://www.reddit.com/r/Futurology/comments/bf3uox/have_you_tried_the_tap_strap_keyboard_might_be/
249,40,/r/futurology,"Elon Musk’s Boring Company East Coast Loop is moving closer to a greenlight, opens to public comments - outlined its plans for a proposed 35-mile underground loop between Baltimore and Washington, D.C. in a draft environmental assessment.",https://electrek.co/2019/04/19/elon-musk-boring-company-east-coast-loop-moving-closer/
250,26,/r/futurology,"Robots That Bake Bread, Make a Salad, And Deliver Takeout Are Coming | Digital Trends - Asked whether human waiters resented their robotic co-worker, Ha said they appreciated not having to hoist the heaviest trays.",https://www.digitaltrends.com/home/food-service-robots-are-coming/
251,28,/r/futurology,"Hand-held devices are turning smartphones into medical imaging tools. This is changing medicine in poor and rural parts of the world, and empowering people globally to be more engaged in their own care. Image shows a four chamber view of the heart taken with such a device.",https://gfycat.com/DenseWelldocumentedEskimodog
252,7,/r/futurology,How to biohack your cells to fight cancer - Greg Foot,https://www.youtube.com/watch?v=Mt5C5fhuU_0
253,23,/r/futurology,What Makes the Impossible Burger Look and Taste Like Real Beef?,https://singularityhub.com/2019/04/19/what-makes-the-impossible-burger-look-and-taste-like-real-beef/
254,6,/r/futurology,Could hydrogen help save nuclear?,https://www.energy.gov/ne/articles/could-hydrogen-help-save-nuclear
255,0,/r/futurology,Ready for 6G? How AI will shape the network of the future,https://www.technologyreview.com/s/613338/ready-for-6g-how-ai-will-shape-the-network-of-the-future/
256,25,/r/futurology,"[in-depth] How it's made: the science behind cultured, clean, and cell-based meat, part 3: bioengineering strategies",https://www.reddit.com/r/Futurology/comments/beybqj/indepth_how_its_made_the_science_behind_cultured/
257,7,/r/futurology,New validation methods and eco-friendly cryptocurrencies aim to counter Bitcoin’s energy consumption problem,https://www.greenbiz.com/article/4-ways-counter-blockchains-energy-consumption-pitfall
258,13,/r/futurology,Phase Separation in Liquid Metal Nanoparticles,https://www.cell.com/matter/fulltext/S2590-2385(19)30005-0
259,14,/r/futurology,Can A Sustainable Industry Be Built From An Invasive Species? A landmark project on the UH Manoa campus shows the albizia tree’s potential as a building material — and the challenges of developing manufacturing in Hawaii.,https://www.civilbeat.org/2019/04/can-a-sustainable-industry-be-built-from-an-invasive-species/
260,19,/r/futurology,"We are not yet doomed: the carbon cutters determined to save the world - They are companies and cities, niche groups and nations. They are off-gridders and off-setters, investors and institutions, cutting their meat intake, installing solar panels, eschewing gas guzzlers and long-haul flights.",https://www.theguardian.com/environment/2019/apr/18/we-are-not-doomed-cutting-carbon
261,2,/r/futurology,China's Political System Helps Advance Its Artificial Intelligence,https://www.voanews.com/a/china-political-system-helps-advance-its-artificial-intelligence/4883302.html
262,5,/r/futurology,Question on the future of cosmetic surgery,https://www.reddit.com/r/Futurology/comments/bf44kw/question_on_the_future_of_cosmetic_surgery/
263,12,/r/futurology,Interview: Carnegie Mellon researchers on the desktop 3D printer turning rigid plastics to fabrics - 3D Printing Industry,https://3dprintingindustry.com/news/interview-carnegie-mellon-researchers-on-the-desktop-3d-printer-turning-rigid-plastics-to-fabrics-153856/
264,13,/r/futurology,U.S. Nuclear Power Plants Weren’t Built for Climate Change- 54 of the nuclear plants operating in the U.S. weren’t designed to handle the flood risk they face.,https://www.bloomberg.com/graphics/2019-nuclear-power-plants-climate-change/
265,11,/r/futurology,Hypersonic Weapons Are Coming. The Pentagon Needs To Spend More On Defending Against Them.,https://www.forbes.com/sites/lorenthompson/2019/04/05/hypersonic-weapons-are-coming-the-pentagon-needs-to-spend-more-on-defending-against-them/#1ad02def7825
266,11,/r/futurology,How advanced would molecular assemblers be ? In terms of their function ?,https://www.reddit.com/r/Futurology/comments/beze7h/how_advanced_would_molecular_assemblers_be_in/
267,9,/r/futurology,America Needs to Think Outside the Box When It Comes to Great Power Conflict,https://nationalinterest.org/blog/buzz/america-needs-think-outside-box-when-it-comes-great-power-conflict-53112
268,125,/r/futurology,"Lab-grown meat companies see opportunity for growth, research in Canada - Cellular agriculture takes cells from animals and grows them to create milk, eggs, meat or other products.",https://www.timescolonist.com/business/lab-grown-meat-companies-see-opportunity-for-growth-research-in-canada-1.23795246
269,7,/r/futurology,"Meet the Marine Lizard: Is China's New Tank All Hype? - The vehicle can travel autonomously, with an AI that can avoid obstacles, and navigate using China’s Beidou GPS satellite system.",https://nationalinterest.org/blog/buzz/meet-marine-lizard-chinas-new-tank-all-hype-53212
270,10,/r/futurology,"A new alphabet for Europe: Algorithms, big data, and the computer chip",https://www.brookings.edu/blog/future-development/2019/04/18/a-new-alphabet-for-europe-algorithms-big-data-and-the-computer-chip/
271,7,/r/futurology,The Navy’s Newest Nemesis: Hypersonic Weapons,http://cimsec.org/the-navys-newest-nemesis-hypersonic-weapons/40135
272,10,/r/futurology,The rise of robots doesn’t have to mean the fall of human workers,https://www.latimes.com/opinion/editorials/la-ed-port-automation-longshoremen-los-angeles-20190416-story.html
273,9,/r/futurology,"Employers and Unions Talk Retraining, Just Not in Contracts - At a time when automation is changing many workplaces and making workers' skill sets obsolete, labor contracts are failing to address retraining.",https://news.bloomberglaw.com/daily-labor-report/employers-and-unions-talk-retraining-just-not-in-contracts
274,9,/r/futurology,Industrial robotics giant Fanuc is using AI to make automation even more automated,https://techcrunch.com/2019/04/18/industrial-robotics-giant-fanuc-is-using-ai-to-make-automation-even-more-automated/
275,9,/r/futurology,"Supercomputer Mixes Streams with CPU, GPU, and FPGA",https://www.nextplatform.com/2019/04/18/supercomputer-mixes-streams-with-cpu-gpu-and-fpga/
