,score,subreddit,title,url
0,22113,/r/worldnews,A giant Trump baby blimp that the president says makes him 'feel unwelcome' is following him to London this summer — and could be 5 times as big,https://www.businessinsider.com/trump-baby-blimp-that-he-hates-returns-to-london-for-june-state-visit-2019-4
1,2069,/r/worldnews,"Rotten eggs: e-waste from Europe poisons Ghana's food chain - Toxins from old computers, fridges and other electronic goods are polluting chicken eggs in an area where 80,000 people live",https://www.theguardian.com/global-development/2019/apr/24/rotten-chicken-eggs-e-waste-from-europe-poisons-ghana-food-chain-agbogbloshie-accra
2,2318,/r/worldnews,Japan apologises to people forcibly sterilised under defunct eugenics law - Survivors will get payouts of 3.2m yen each for policy aimed at ‘preventing birth of poor-quality descendants’,https://www.theguardian.com/world/2019/apr/24/japan-apologises-to-people-forcibly-sterilised-under-defunct-eugenics-law
3,885,/r/worldnews,"The U.S. government is targeting immigration lawyers, activists, and reporters at the Mexico border, a leaked Homeland Security database confirms.",https://bostonreview.net/global-justice/lauren-carasik-government-targeting-immigration-lawyers-activists-journalists
4,1042,/r/worldnews,Greenland lost roughly half its sea ice in just 8 years (2010-2018),https://www.theatlantic.com/science/archive/2019/04/how-much-ice-has-greenland-lost-climate-change/587431/
5,583,/r/worldnews,"China And Turkey Defy US, Will Continue To Import Iran Oil",https://www.ibtimes.com/china-turkey-defy-us-will-continue-import-iran-oil-2787220
6,49078,/r/worldnews,"Twitter shuts down 5,000 pro-Trump bots retweeting anti-Mueller report invective | Ars Technica",https://arstechnica.com/information-technology/2019/04/twitter-shuts-down-network-of-5000-possibly-saudi-pro-trump-bots/
7,6121,/r/worldnews,"Saudi Arabia beheads 37 mostly Shiite citizens, displays executed body",https://www.smh.com.au/world/middle-east/saudi-arabia-beheads-37-mostly-shiite-citizens-displays-executed-body-20190424-p51gnz.html
8,317,/r/worldnews,Dutch fence off tulip fields to stop selfie-takers crushing flowers - Barriers put up to deter ‘careless’ tourists from seeking perfect picture among bulbs,https://www.theguardian.com/world/2019/apr/24/netherlands-tulip-fields-barriers-tourists-selfie-takers
9,179,/r/worldnews,The American Bumblebee Is Facing Extinction in Canada: The species has decreased by 70% within its known Canadian boundaries.,https://motherboard.vice.com/en_us/article/3k3qq3/the-american-bumblebee-is-facing-extinction-in-canada
10,15011,/r/worldnews,Malawi becomes 1st nation to immunize kids against malaria,https://www.apnews.com/038b41fecfb143b98bf6b5d5228ea724
11,416,/r/worldnews,"France marks first national commemoration of Armenian genocide. France’s recognition of the massacre as a genocide was enshrined in law in 2001, following a lengthy struggle that has strained relations with Turkey.",https://www.france24.com/en/20190424-france-national-commemoration-armenian-genocide
12,2509,/r/worldnews,"Russian court fines Internet user 30,000 rubles ($470) for calling Vladimir Putin an ‘unbelievable fuckwit’",https://meduza.io/en/news/2019/04/23/russian-court-fines-internet-user-hundreds-of-dollars-for-calling-vladimir-putin-an-unbelievable-fuckwit
13,596,/r/worldnews,"Hong Kong's 'Occupy Central' activists handed down prison terms, a court in Hong Kong has handed down prison sentences of up to 16 months to eight leaders of massive 2014 pro-democracy protests",https://www.aljazeera.com/news/2019/04/hong-kong-occupy-central-activists-handed-prison-sentences-190424013728788.html
14,4462,/r/worldnews,Mueller: Manafort Discussed Enlisting Trump to Aid Russia in Ukraine,https://www.motherjones.com/politics/2019/04/mueller-manafort-kilimnik-ukraine-russia/
15,185,/r/worldnews,Russian Interference Went Far Beyond 'Facebook Ads' Kushner Described - Trump's son-in-law & senior adviser said the investigations into Russian interference have been more damaging than the interference itself. But there was more to it than online ads.,https://www.npr.org/2019/04/24/716374421/fact-check-russian-interference-went-far-beyond-facebook-ads-kushner-described
16,80,/r/worldnews,Kuwaiti academic claims semen-eating anal worms cause homosexuality,https://www.pinknews.co.uk/2019/04/24/kuwaiti-academic-semen-eating-anal-worms-homosexuality/
17,224,/r/worldnews,"Canada oil sands CO2 emissions hugely underestimated: Canada's oil sands CO2 emissions are significantly higher than indicated by industry data collected using internationally recommended methods, according to a study published Tuesday",https://phys.org/news/2019-04-canada-oil-sands-co2-emissions.html
18,1245,/r/worldnews,Google employees who helped organize a global employee protest in November are now saying the company is punishing them for their activism.,https://www.vox.com/2019/4/23/18512542/google-employee-walkout-organizers-claim-retaliation
19,3824,/r/worldnews,"The construction of a metro network beneath the Greek city of Thessaloniki has unearthed an extraordinary treasure trove of ancient artefacts, from gold wreaths and rings to statues of the goddess Aphrodite. “The excavations are the biggest archaeological project of recent years in Greece”",https://www.telegraph.co.uk/news/2019/04/21/archeological-treasures-found-metro-construction-greece/
20,2445,/r/worldnews,New Zealand and France have announced that they will bring countries and tech companies together to try and stop social media platforms from being used to promote terrorism and violent extremism.,https://www.stuff.co.nz/national/politics/112224153/new-zealand-and-france-join-forces-to-tackle-terrorism-and-violence-on-social-media
21,104,/r/worldnews,"Undeterred by Khashoggi murder, global executives return to Saudi Arabia",https://www.reuters.com/article/us-saudi-finance-khashoggi-idUSKCN1S01DX?utm_campaign=trueAnthem:+Trending+Content&utm_content=5cc05e0816ce3f000141f29b&utm_medium=trueAnthem&utm_source=twitter
22,96,/r/worldnews,"NASA just detected the first ""marsquake"" on the red planet",https://www.cbsnews.com/news/marsquake-nasa-detected-first-marsquake-on-the-red-planet/
23,102,/r/worldnews,Butina Cooperated With the US Feds. They Want Her Locked Up. - The Russian agent had been hoping for a speedy deportation. But prosecutors want her to stay behind bars for doing damage they say can aid the Kremlin for ‘years to come.’,https://www.thedailybeast.com/maria-butina-cooperated-with-the-feds-now-they-want-to-throw-the-book-at-her?ref=home
24,176,/r/worldnews,"Trump must lift sanctions and apologize before Iran returns to nuclear negotiations, Rouhani says",https://www.haaretz.com/middle-east-news/1.7162976
25,59863,/r/worldnews,"Donald Trump's U.K. State Visit Faces 'Maximum Disruption,' Protesters Vow to Make Trip 'as Unpleasant as Possible'",https://www.newsweek.com/donald-trump-uk-state-visit-protests-maximum-disruption-1403419
26,60,/r/worldnews,Trump Warns Mexico After Armed Mexican Soldiers Confronted U.S. Soldiers on U.S. Soil,https://www.haaretz.com/us-news/trump-warns-mexico-after-armed-mexican-soldiers-confronted-u-s-soldiers-on-u-s-soil-1.7162060
27,45,/r/worldnews,Support for Extinction Rebellion soars after Easter protests,https://www.theguardian.com/environment/2019/apr/24/support-for-extinction-rebellion-soars-in-wake-of-easter-protests
28,1313,/r/worldnews,France to invest €6 million in free breakfasts at public schools,https://www.france24.com/en/20190423-france-invest-6-million-euros-free-breakfast-public-schools
29,70,/r/worldnews,UN: Pro-government forces kill more Afghans than insurgents,https://apnews.com/0aa6afe07a23489b8bcefef54c493abb?utm_source=Twitter&utm_campaign=SocialFlow&utm_medium=AP
30,69,/r/worldnews,"Sri Lankan President Maithripala Sirisena has asked the police chief and defense secretary to quit following the Easter Sunday suicide bomb attacks on churches and luxury hotels that killed 359 people, two sources close to the president said on Wednesday.",https://mobile.reuters.com/article/amp/idUSKCN1S017E
31,2789,/r/worldnews,"Trump vows to ""reciprocate"" against the EU after Harley-Davidson reports 26.7 percent profit drop",https://www.nbcnews.com/business/autos/trump-vows-reciprocate-against-eu-after-harley-davidson-reports-26-n997456
32,24,/r/worldnews,"Kushner Talks of 'Accountability' for Crown Prince Just as Saudis Offer 'Egregious Display of Brutality' With Mass Beheadings: Washington's Gulf Institute director Ali Al-Ahmed called the killings ""the largest mass execution of Shiites in the kingdom's history.""",https://www.commondreams.org/news/2019/04/23/kushner-talks-accountability-crown-prince-just-saudis-offer-egregious-display
33,3211,/r/worldnews,"'It's already begun': Feedback loops will make climate change even worse, scientists say | It is “feedback loops” like these that make climate change unpredictable and represent a threat of global warming spiraling out of control",https://news.yahoo.com/its-already-begun-feedback-loops-will-make-climate-change-even-worse-scientists-say-090000011.html
34,27,/r/worldnews,Leaders of Hong Kong's pro-democracy movement jailed for 16 months,https://www.cnn.com/2019/04/24/asia/umbrella-movement-leaders-sentence-intl/index.html
35,485,/r/worldnews,Fake meat maker plans real IPO that values company at $1.2 billion,https://www.cbsnews.com/news/beyond-meat-ipo-maker-of-vegan-burgers-plans-initial-public-offering-that-values-company-at-1-2-billion/
36,117,/r/worldnews,"Terrorist’s Wife Sets Off Bomb At Her Home During Police Raid; Kills Her Three Kids, Three Cops",https://swarajyamag.com/insta/sri-lanka-terrorists-wife-sets-off-bomb-at-her-home-during-police-raid-kills-her-three-kids-three-cops
37,62,/r/worldnews,"E-cigarette fluids and cartridges contain bacteria and fungi toxins, study finds",https://www.independent.co.uk/news/health/vaping-e-cigarette-bacteria-fungus-cigarette-smoking-health-risk-a8882481.html
38,4058,/r/worldnews,Islamic state claims responsibility for Sri Lankan bombings,https://www.reuters.com/article/us-sri-lanka-blasts-claim/islamic-state-claims-responsibility-for-sri-lanka-bombings-idUSKCN1RZ102
39,19,/r/worldnews,Researchers Create ‘First-of-its-Kind’ Roadmap for Saving Earth From Climate Change Years Before 2050 Deadline,https://www.goodnewsnetwork.org/first-of-its-kind-roadmap-to-save-earth-from-climate-change-before-2050/
40,20,/r/worldnews,Student slated to attend Western Michigan University beheaded in Saudi Arabia,https://www.freep.com/story/news/education/2019/04/23/saudi-arabia-beheadings-executions-mujtaba-al-sweikat/3552679002/
41,1201,/r/worldnews,Philippines' Duterte threatens 'war' if Canada doesn't take trash back,https://www.ctvnews.ca/world/philippines-duterte-threatens-war-if-canada-doesn-t-take-trash-back-1.4390852
42,81,/r/worldnews,German watchdog says Amazon cloud vulnerable to US snooping,https://www.politico.eu/article/german-privacy-watchdog-says-amazon-cloud-vulnerable-to-us-snooping/
43,1180,/r/worldnews,"World's first malaria vaccine to go to 360,000 African children",https://edition.cnn.com/2019/04/23/health/malaria-africa-worlds-first-vaccine-intl/index.html
44,19,/r/worldnews,Boxing: Boxing - Iranian female fighter cancels return home after arrest warrant issued,https://www.thestar.com.my/sport/boxing/2019/04/17/boxing-iranian-woman-cancels-return-home-after-arrest-warrant-issued--source/
45,24,/r/worldnews,Two new species of bird discovered in Indonesia,https://www.irishtimes.com/news/science/birds-of-a-feather-two-new-species-discovered-by-trinity-zoologists-1.3869530
46,46,/r/worldnews,‘I have long dreamed of visiting’: Kim Jong Un arrives in Russia for talks with Putin,https://www.washingtonpost.com/world/i-have-long-dreamed-of-visiting-kim-jong-un-arrives-in-russia-for-talks-with-putin/2019/04/24/8fc930fe-65c2-11e9-a698-2a8f808c9cfb_story.html
47,33,/r/worldnews,"Bowing to US demands, UN waters down resolution on sexual violence in conflict",https://www.straitstimes.com/world/united-states/bowing-to-us-demands-un-waters-down-resolution-on-sexual-violence-in-conflict
48,22,/r/worldnews,"What's Being Done About Trash (& Bodies) on Everest - This year, govts & guiding companies are promising to do more to keep the mountain clean, but the question of what to do with the dead bodies is becoming more urgent",https://www.outsideonline.com/2394520/everest-dead-bodies-trash-removal
49,62,/r/worldnews,"Major meeting in Paris to review first global biodiversity assessment since 2005: The first global biodiversity assessment in 14 years is to be discussed next week. ""The loss of species, ecosystems and genetic diversity is already a global and generational threat to human well-being,"" scientists say",https://www.dw.com/en/major-meeting-in-paris-to-review-first-global-biodiversity-assessment-since-2005/a-48451742
50,347,/r/worldnews,France blasts US for weakened UN resolution on sexual violence in conflicts,https://www.france24.com/en/20190423-un-resolution-sexual-violence-conflicts-france-usa
51,23,/r/worldnews,"“Pest” bird species such as crows, woodpigeons and jays can no longer be freely killed in England after the government’s conservation watchdog revoked the licence permitting it.",https://www.theguardian.com/environment/2019/apr/24/woodpigeons-and-crows-can-no-longer-be-freely-killed-in-england
52,11,/r/worldnews,Scotland's First Minister calls for second independence referendum by 2021,https://www.dw.com/en/scotlands-first-minister-calls-for-second-independence-referendum-by-2021/a-48464353
53,34,/r/worldnews,"The US has two aircraft carriers in the Mediterranean to send a message to Russia. ""Each of the carriers operating in the Mediterranean at this time represent 100,000 tons of international diplomacy,"" the US Ambassador to Russia said in a news release.",https://taskandpurpose.com/navy-aircraft-carriers-mediterranean-russia
54,364,/r/worldnews,UN waters down rape resolution to appease US's hardline abortion stance | Global development,https://www.theguardian.com/global-development/2019/apr/23/un-resolution-passes-trump-us-veto-threat-abortion-language-removed
55,11,/r/worldnews,U.N. rights boss condemns Saudi Arabia's beheading of 37 men,https://www.reuters.com/article/us-saudi-execution-un/u-n-rights-boss-condemns-saudi-arabias-beheading-of-37-men-idUSKCN1S01CA
56,16,/r/worldnews,Migrant caravan: Mexico detains hundreds in raid,https://www.bbc.com/news/world-latin-america-48036092
57,1416,/r/worldnews,Parkinson's results beyond researchers' wildest dreams | A treatment that has restored the movement of patients with chronic Parkinson's disease has been developed by Canadian researchers.,https://www.bbc.co.uk/news/health-47803496
58,3178,/r/worldnews,Sri Lankan Minister of Defense claims attacks were in retaliation for Christchurch mosque attacks,https://www.newshub.co.nz/home/world/2019/04/sri-lankan-minister-of-defense-claims-attacks-were-in-retaliation-for-christchurch-mosque-attacks.html
59,1554,/r/worldnews,Two Muslim brothers were Sri Lanka hotel suicide bombers: sources,https://www.france24.com/en/20190423-two-muslim-brothers-were-sri-lanka-hotel-suicide-bombers-sources
60,16,/r/worldnews,British PM approves Huawei role in 5G network: report,https://news.yahoo.com/british-pm-approves-huawei-role-5g-network-report-071728788.html
61,11,/r/worldnews,Scotland will prepare for a second independence vote regardless of UK: Sturgeon,https://www.reuters.com/article/us-britain-eu-scotland/scotland-will-prepare-for-a-second-independence-vote-regardless-of-uk-sturgeon-idUSKCN1S01PB?feedType=RSS&feedName=worldNews&utm_source=feedburner&utm_medium=feed&utm_campaign=Feed%3A+Reuters%2FworldNews+%28Reuters+World+News%29
62,18,/r/worldnews,E-cigarette study finds bacterial and fungal toxins in some products,https://www.axios.com/e-cigarettes-contaminated-bacterial-fungal-toxins-dea6e233-2797-45b8-911c-bc936af0ddcb.html
63,7,/r/worldnews,"Food makers in Europe get letters with poisoning threats — Major food companies in Italy, Denmark received letters containing unidentified powder and written threat requesting they pay money or risk poisoning of their products. Letters sent to companies in Belgium, Germany, Austria, Britain, Sweden.",https://apnews.com/5cceba3b333b483b8881e847493de432
64,9,/r/worldnews,Trump threatens to send armed troops to Mexican border.,https://nypost.com/2019/04/24/trump-threatens-to-send-armed-troops-to-mexican-border/
65,36,/r/worldnews,'Eat it if you want to': Filipino President Duterte lashes out over Canadian cargo of trash,https://www.cbc.ca/news/politics/duterte-canada-president-1.5107539?__vfz=medium%3Dsharebar
66,18,/r/worldnews,Top Sri Lankan officials deliberately withheld intelligence on attacks: Minister,https://www.reuters.com/article/us-sri-lanka-blasts-intelligence/top-sri-lankan-officials-deliberately-withheld-intelligence-on-attacks-minister-idUSKCN1S00NN
67,176,/r/worldnews,"Theresa May has ordered that Chinese telecoms supplier Huawei is to be banned from supplying core parts of the future 5G mobile phone network, following a meeting of ministers on the National Security Council (NSC) on Tuesday",https://www.theguardian.com/technology/2019/apr/24/may-to-ban-huawei-from-supplying-core-parts-of-uk-5g-network
68,9,/r/worldnews,Trump suggests one day after announcement of state visit that UK spied on his campaign,https://thehill.com/homenews/administration/440428-trump-suggests-one-day-after-announcement-of-state-visit-that-uk
69,10,/r/worldnews,Suspected Islamic State member arrested over alleged plan to attack Gallipoli,https://www.abc.net.au/news/2019-04-24/turkey-arrests-islamic-state-member-planning-gallipoli-attack/11045126
70,10,/r/worldnews,Gold worth billions smuggled out of Africa,https://www.reuters.com/article/us-gold-africa-smuggling-exclusive/exclusive-gold-worth-billions-smuggled-out-of-africa-idUSKCN1S00IT
71,15,/r/worldnews,UK to allow Huawei to help build 5G,https://www.bbc.com/news/uk-48032286
72,14,/r/worldnews,"Adolf Hitler's 'suicide note' refusing to flee besieged Berlin and vowing to continue ‘honourable fight’ to fetch £70,000 at auction",https://www.thesun.co.uk/news/8928209/adolf-hitler-suicide-note-refused-flee-berlin-auction/
73,27,/r/worldnews,MKs call on Israel to recognize Armenian Genocide,https://m.jpost.com/Middle-East/MKs-call-on-Israel-to-recognize-Armenian-Genocide-587760
74,8,/r/worldnews,Malaysia has turned into the world's dumping ground and now its environmental officials wants countries to take their trash back,https://www.businessinsider.sg/chinas-waste-ban-has-turned-malaysia-into-the-worlds-dumping-ground-and-now-malaysias-climate-change-minister-wants-exporting-countries-to-take-their-trash-back/
75,8,/r/worldnews,US measles outbreak is largest since disease was declared eliminated in 2000,https://www.cnn.com/2019/04/24/health/measles-outbreak-record-us-bn/index.html
76,9,/r/worldnews,"Afghan and U.S.-led allied forces killed more civilians than Taliban in first 3 months of 2019, U.N. says",https://www.cbsnews.com/news/afghanistan-us-nato-coalition-kill-more-civilians-first-3-months-2019-taliban-un/
77,15,/r/worldnews,Fury as Southend Airport revamp leaves jets taxiing just 150ft away from pensioner's garden,https://news.sky.com/story/fury-as-southend-airport-revamp-moves-jets-just-150ft-away-from-pensioners-back-garden-11702181
78,6,/r/worldnews,The capital of Canada has declared a climate emergency,https://ottawacitizen.com/news/local-news/ottawa-declares-a-climate-emergency
79,17,/r/worldnews,Even Google employees don't know who runs Google,https://elgan.com/blog/even-google-employees-dont-know-who-runs-google
80,79,/r/worldnews,Iran's Parliament approves bill labeling US army as 'terrorist',https://www.aljazeera.com/news/2019/04/iran-parliament-approves-bill-labeling-army-terrorist-190423111221587.html
81,7,/r/worldnews,Top Justice Department Official Will Defy Congress,https://www.thedailybeast.com/john-gore-a-top-doj-official-will-defy-congress?via=twitter_page
82,8,/r/worldnews,Picture emerges of well-to-do young bombers behind Sri Lankan carnage,https://www.reuters.com/article/us-sri-lanka-blasts/picture-emerges-of-well-to-do-young-bombers-behind-sri-lankan-carnage-idUSKCN1S00G2
83,5,/r/worldnews,Duterte threatens 'war' against Canada over trash shipped to Philippines,https://www.cnn.com/2019/04/24/asia/duterte-canada-trash-intl/index.html
84,3964,/r/worldnews,"Microsoft workers decry grueling '996' (9am-9pm, 6 days a week) working standard at Chinese tech firms: A letter on Github demanded companies comply with labor laws, limiting workers to 40 hours a week versus a 12-hour day standard",https://www.theguardian.com/technology/2019/apr/22/microsoft-workers-decry-grueling-996-working-standard-at-chinese-tech-firms?CMP=Share_iOSApp_Other
85,8,/r/worldnews,Gunmen in Pakistan kill policeman guarding polio eradication team,https://uk.reuters.com/article/uk-pakistan-polio/gunmen-in-pakistan-kill-policeman-guarding-polio-eradication-team-idUKKCN1S01C4?il=0
86,11,/r/worldnews,China complains to U.S. over end to Iran oil sanction waivers,https://www.reuters.com/article/us-usa-iran-sanctions-china-idUSKCN1RZ0OP
87,7,/r/worldnews,Turkey arrest Islamic State member over alleged Gallipoli threat,https://www.news.com.au/world/turkey-arrest-islamic-state-member-over-alleged-gallipoli-threat/news-story/c341d250a89f2ad3263a5f2e72b9a437
88,46,/r/worldnews,Indian officials travel deep into jungle so lone holy man can vote,https://www.theguardian.com/world/2019/apr/24/indian-officials-travel-deep-into-jungle-so-lone-holy-man-can-vote
89,50,/r/worldnews,Possible 'marsquake' detected for first time on red planet: Nasa probe InSight picks up slight tremor that fits profile of similar episodes on the moon,https://www.theguardian.com/science/2019/apr/24/possible-marsquake-detected-for-first-time-on-red-planet
90,5,/r/worldnews,"'Utterly Ridiculous': Donald Trump Tweet Claiming U.K. Intelligence Helped Obama Spy on Campaign 'Should Be Ignored,' GCHQ Says",http://www.newsweek.com/trump-tweet-uk-intelligence-obama-spying-campaign-ridiculous-1404546
91,5,/r/worldnews,"Israel already an apartheid state says outgoing French ambassador, discussing Trump's peace plan",https://www.haaretz.com/us-news/israel-is-already-an-apartheid-state-says-outgoing-french-ambassador-1.7151731
92,8,/r/worldnews,UN Waters Down Sexual Violence Resolution at U.S. Request,http://time.com/5577089/un-resolution-sexual-violence-weakened-language/
93,7,/r/worldnews,WHO recommends one-hour maximum screen time per day for under-5s,http://news.trust.org//item/20190424125844-jb0r6/
94,14,/r/worldnews,Trump promotes conspiracy theory that UK helped Obama administration spy on his presidential campaign,https://www.independent.co.uk/news/world/americas/us-politics/trump-uk-obama-mi6-phone-tap-spy-larry-johnson-twitter-latest-us-news-a8884056.html?amp
95,82,/r/worldnews,"Tobacco company Philip Morris starts life insurance firm that offers discounts to smokers who quit - Smokers will receive discounts if they stop, quit or switch to a possibly less carcinogenic product, like Philip Morris’ vaping devices.",https://www.cnbc.com/2019/04/23/tobacco-company-philip-morris-launches-life-insurance-company-reviti.html
96,7,/r/worldnews,"Rotten eggs: e-waste from Europe poisons Ghana's food chain | Toxins from old computers, fridges and other electronic goods are polluting chicken eggs in an area where 80,000 people live",https://www.theguardian.com/global-development/2019/apr/24/rotten-chicken-eggs-e-waste-from-europe-poisons-ghana-food-chain-agbogbloshie-accra
97,10,/r/worldnews,"Popular children to be recruited as anti-drug 'influencers' in UK Government funded project - Teenagers, who have been voted by their classmates as the most influential, will be trained to discourage their peers from taking illegal substances.",https://www.telegraph.co.uk/education/2019/04/23/popular-children-recruited-anti-drug-influencers-government/
98,5,/r/worldnews,"Philippines' Duterte Talks Trash (Literally) To Canada, Threatening War Over Garbage -- More than 100 shipping containers had been declared to hold recyclable plastic scraps. But when they arrived in Manila, officials found household trash, including adult diapers.",https://www.npr.org/2019/04/24/716692612/philippines-duterte-talks-trash-literally-to-canada-threatening-war-over-garbage
99,7,/r/worldnews,Lyra McKee: Standing ovation as priest challenges politicians,https://www.bbc.co.uk/news/uk-northern-ireland-48039266
100,15,/r/worldnews,North Korea 'executes four officials by firing squad after failed US summit',https://www.mirror.co.uk/news/world-news/north-korea-executes-four-officials-14544273
101,27,/r/worldnews,British gun activist loses firearms licences after saying French should have been able to defend themselves with handguns following Bataclan massacre,https://www.dailymail.co.uk/news/article-6949889/British-gun-activist-loses-firearms-licences.html
102,30034,/r/worldnews,Mueller report: Russia hacked state databases and voting machine companies. Russian intelligence officers injected malicious SQL code and then ran commands to extract information,https://www.rollcall.com/news/whitehouse/barrs-conclusion-no-obstruction-gets-new-scrutiny
103,43,/r/worldnews,Japan passes law to compensate forced sterilisation victims,https://www.channelnewsasia.com/news/asia/japan-passes-law-to-compensate-forced-sterilisation-victims-11473646
104,4,/r/worldnews,Twitter CEO Gently Tells Trump: Your ‘Lost’ Followers Are Bots and Spam Accounts,https://www.thedailybeast.com/trump-gets-gentle-reassurance-from-twitter-chief-jack-dorsey-over-follower-count-in-white-house-meeting?
