,score,subreddit,title,url
339,8,/r/worldnews,"Royal Canadian Mounted Police's new strategy for tackling terrorism, organized crime — accountants, computer whizzes and data geeks",https://nationalpost.com/news/canada/exclusive-rcmps-new-strategy-for-tackling-terrorism-organized-crime-accountants-computer-whizzes-and-data-geeks
340,13,/r/worldnews,"Ringleader of North Korean Embassy raid in hiding from hit squads, attorney says",https://edition.cnn.com/2019/04/22/politics/north-korea-madrid-embassy-raid/index.html
341,7,/r/worldnews,"US threatens to veto UN resolution on helping rape victims, over mentions of reproductive health",https://www.cnn.com/2019/04/22/politics/us-united-nations-sexual-violence-resolution/index.html
342,14,/r/worldnews,Melting permafrost in Arctic will have $70tn climate impact,https://www.theguardian.com/environment/2019/apr/23/melting-permafrost-in-arctic-will-have-70tn-climate-impact-study
343,17,/r/worldnews,Nigerian 'children killed' after car hits Easter parade in Gombe,https://www.bbc.com/news/world-africa-48021820
344,13,/r/worldnews,"Iraq says any action to raise oil output won't be unilateral, any decision to raise or decrease production must be taken collectively by OPEC... about US end waivers that allowed some nations to buy Iranian oil without facing U.S. sanctions.",https://www.reuters.com/article/us-oil-opec-iraq/iraq-says-any-action-to-raise-oil-output-wont-be-unilateral-ministry-spokesman-idUSKCN1RY0FD
345,13,/r/worldnews,Oil hits highest since November as U.S. to tighten Iran sanctions,https://www.reuters.com/article/us-global-oil/oil-hits-highest-since-november-as-u-s-to-tighten-iran-sanctions-idUSKCN1RZ01O
346,5,/r/worldnews,Donald Trump set for state visit in June,https://www.bbc.com/news/uk-48020410
347,7,/r/worldnews,New IRA apologizes for murder of Irish journalist Lyra McKee,https://abcnews.go.com/International/ira-apologizes-murder-irish-journalist-lyra-mckee/story?id=62569856
348,9,/r/worldnews,Italian mayor bans bean growing to help child with rare allergy - Broad bean cultivation banned within 300-metre radius of child’s home near Florence,https://www.theguardian.com/world/2019/apr/23/italian-mayor-bans-bean-growing-help-child-rare-allergy
349,36,/r/worldnews,WW2 shipwreck found off Australia's coast,https://www.bbc.com/news/world-australia-48018313
350,11,/r/worldnews,Google Blocks Iranian State TV's YouTube Accounts After Anti-Israel Propaganda,https://www.forbes.com/sites/zakdoffman/2019/04/23/google-blocks-iranian-state-tvs-youtube-and-gmail-after-anti-israel-propaganda/
351,4,/r/worldnews,Sajid Javid urged to act in immigration scandal 'bigger than Windrush',https://www.theguardian.com/uk-news/2019/apr/23/toeic-english-test-sajid-javid-urged-to-act-in-immigration-scandal-bigger-than-windrush
352,5,/r/worldnews,Netanyahu says he'll name Golan Heights town after Trump,https://www.timesofisrael.com/netanyahu-says-hell-name-golan-heights-town-after-trump/
353,43,/r/worldnews,Researchers Identify Molecule With Anti-Aging Effects On Vascular System,https://www.solutionfactory.in/Researchers-Identify-Molecule-With-Anti-Aging-Effects-On-Vascular-System.html
354,3,/r/worldnews,"Pakistan: Peshawar police arrest man alleging polio vaccines cause children to faint, die",https://www.dawn.com/news/1477890/
355,5,/r/worldnews,UN says that over 260 have been killed in the recent clashes in Libya.,https://www.france24.com/en/20190423-un-says-over-260-killed-libya-battle-african-leaders-meet
356,7,/r/worldnews,Escalating fighting in Libya capital threatens Tunisia,https://www.middleeastmonitor.com/20190423-escalating-fighting-in-libya-capital-threatens-tunisia/
357,0,/r/worldnews,"In the Mediterranean, US aircraft carrier operations serve as floating American diplomacy",https://www.cnn.com/2019/04/23/europe/us-carrier-operations-mediterranean-sea/index.html
358,5245,/r/worldnews,Comedian Volodymyr Zelenskiy elected President of Ukraine after landslide victory.,https://www.nbcnews.com/news/world/ukraine-elections-comedian-volodymyr-zelenskiy-declares-victory-presidential-race-n996776
359,13,/r/worldnews,More than 50 believed killed in collapse at Myanmar jade mine,https://www.reuters.com/article/us-myanmar-mine/more-than-50-believed-killed-in-collapse-at-myanmar-jade-mine-idUSKCN1RZ0XS
360,4,/r/worldnews,Saudi Arabia Has Executed 37 People For Terrorism-Related Crimes,http://time.com/5576102/saudi-arabia-execution-terrorism-crimes/
361,4,/r/worldnews,Hong Kong Property Tycoon Gave Away His Son's Inheritance Worth $400m,https://www.bloomberg.com/news/articles/2019-04-22/hong-kong-property-scion-has-no-house-no-inheritance
362,6,/r/worldnews,India elections: Voting under way for the third phase,https://www.aljazeera.com/news/2019/04/voting-begins-phase-india-elections-190423020542659.html
363,6,/r/worldnews,One million species risk extinction due to humans — draft UN report,https://mg.co.za/article/2019-04-23-one-million-species-risk-extinction-due-to-humans-draft-un-report
364,15,/r/worldnews,New Irish Republican Army apologizes for killing of Northern Ireland journalist,https://www.reuters.com/article/us-nireland-violence/new-ira-apologizes-for-killing-of-northern-ireland-journalist-idUSKCN1RZ0K1
365,6,/r/worldnews,Melting permafrost in Arctic will have $70tn climate impact – study | The authors say their study is the first to calculate the economic impact of permafrost melt and reduced albedo,https://www.theguardian.com/environment/2019/apr/23/melting-permafrost-in-arctic-will-have-70tn-climate-impact-study
366,52,/r/worldnews,"'Operation Blackout is underway': Russia blames US for Venezuela power crisis - Russia has accused the United States of deliberately causing a succession of crippling power cuts in Venezuela as part of a plot to topple its president, Nicolás Maduro, dubbed “Operation Blackout”.",https://www.theguardian.com/world/2019/apr/23/operation-blackout-is-underway-russia-blames-us-for-venezuela-power-crisis
367,6212,/r/worldnews,"A Vancouver woman is sounding the alarm for millions of Canadians who have credit and debit cards, after information about her debit card was shared when it shouldn't have been.",https://www.cbc.ca/news/business/banking-information-shared-with-third-parties-1.5102931
368,12,/r/worldnews,"Vietnam just observed its highest temperature ever recorded: 110 degrees, in April",https://www.washingtonpost.com/weather/2019/04/22/vietnam-just-observed-its-highest-temperature-ever-recorded-degrees-april/?utm_term=.ddc15112d2e8
369,3,/r/worldnews,Protesters from city where Sudan uprising began head for Khartoum,https://www.reuters.com/article/us-sudan-politics/protesters-from-city-where-sudan-uprising-began-head-for-khartoum-idUSKCN1RZ15G
370,4,/r/worldnews,Kushner says has urged Saudi prince to be transparent about Khashoggi killing,https://www.reuters.com/article/us-usa-trump-khashoggi/kushner-says-has-urged-saudi-prince-to-be-transparent-about-khashoggi-killing-idUSKCN1RZ1WW
371,8,/r/worldnews,"Second team of NTJ terrorists ready for bombing, Indian officials tell Lanka",https://m.hindustantimes.com/world-news/second-team-of-ntj-terrorists-ready-for-bombing-indian-officials-tell-lanka/story-uFrIUa8G8H34JcuZMdDVYI.html
372,42,/r/worldnews,"Microsoft workers decry grueling '996' working standard at Chinese tech firms - A letter on Github demanded companies comply with labor laws, limiting workers to 40 hours a week versus a 12-hour day standard",https://www.theguardian.com/technology/2019/apr/22/microsoft-workers-decry-grueling-996-working-standard-at-chinese-tech-firms
373,6,/r/worldnews,Christchurch attack survivors offered New Zealand residency,https://www.reuters.com/article/us-newzealand-shooting-immigration/christchurch-attack-survivors-offered-new-zealand-residency-idUSKCN1RZ1O8
374,16,/r/worldnews,"Top AKP leader blames Erdogan for party losses, economic crisis",https://www.middleeasteye.net/news/top-akp-leader-blames-erdogan-party-losses-economic-crisis
375,36,/r/worldnews,Myanmar's top court rejects final appeal by jailed Reuters journalists,https://www.reuters.com/article/us-myanmar-journalists/myanmars-top-court-rejects-final-appeal-by-jailed-reuters-journalists-idUSKCN1RZ06O
376,23,/r/worldnews,"First past the post abets extreme politics, says thinktank",https://www.theguardian.com/politics/2019/apr/23/first-past-the-post-abets-extreme-politics-says-thinktank
377,8,/r/worldnews,UK watchdog urges EU to make financial market access flexible,https://www.reuters.com/article/uk-britain-eu-markets/uk-watchdog-urges-eu-to-make-financial-market-access-flexible-idUSKCN1RZ1BT
378,37,/r/worldnews,Kim-Putin: North Korean and Russian leaders 'to meet for first time',https://www.bbc.com/news/world-asia-47972954
379,7,/r/worldnews,Philippines Quake Magnitude 6.3 Hits Day After 6.1 Earthquake,https://www.bloomberg.com/news/articles/2019-04-22/philippine-quake-kills-at-least-10-review-of-structures-ongoing
380,3,/r/worldnews,Israel to name new town on Golan after Trump: Netanyahu,https://www.reuters.com/article/us-israel-usa-golan/israel-to-name-new-town-on-golan-after-trump-netanyahu-idUSKCN1RZ1QQ
381,31,/r/worldnews,"Oil surges 2.7% to a nearly 6-month high, settling at $65.70 after Trump cracks down on Iran exports.",https://www.cnbc.com/2019/04/22/energy-prices-up-on-reported-end-to-sanctions-waiver-for-iranian-oil.html
382,24,/r/worldnews,"Chinese people love peace, Xi says",https://www.canberratimes.com.au/story/6086102/chinese-people-love-peace-xi-says/?cs=14232
383,219,/r/worldnews,"Turkish police arrest ruling party member, eight others after opposition chief attack",https://www.france24.com/en/20190422-turkish-police-arrest-ruling-party-member-eight-others-after-opposition-chief-attack
384,2,/r/worldnews,Netanyahu wants to name a village in the Golan Heights after Trump,https://www.axios.com/netanyahu-name-village-golan-heights-after-trump-48999d5b-475a-450b-a75c-aae2c9046c1c.html
385,16,/r/worldnews,Deadly quake rocks northern Philippines,https://www.bbc.com/news/world-asia-48015683
386,789,/r/worldnews,Earthquake of 6.4 magnitude strikes central Philippines: USGS,https://www.reuters.com/article/us-philippines-quake/earthquake-of-6-4-magnitude-strikes-central-philippines-usgs-idUSKCN1RY0J3
387,8,/r/worldnews,"Patrick Brown told a top Ontario Progressive Conservative Party donor to give $5,000 to the then-leader’s girlfriend on the same day he agreed to let the supporter’s candidate run in a controversial nomination race, according to newly unsealed court documents.",https://www.theglobeandmail.com/canada/article-ontarios-brown-asked-donor-to-give-funds-to-girlfriend/
388,6,/r/worldnews,Ugandan police disperse supporters of popular lawmaker Bobi Wine with water cannon,https://af.reuters.com/article/topNews/idAFKCN1RY0XX-OZATP
389,11,/r/worldnews,"Warming climate has grown UK economy 10% in past 50 years, but shrunk the poorest by a third, study says - Big emitters like UK, Norway and Canada have seen economic benefits of warming temperatures since 1960, while nations like Sudan and India have suffered",https://www.independent.co.uk/environment/climate-change-inequality-global-warming-temperature-rising-sudan-uk-india-canada-norway-a8881526.html
390,88,/r/worldnews,Kazakh Activists Jailed For Making a Simple Statement: 'I Have a Choice',https://thediplomat.com/2019/04/kazakh-activists-jailed-for-making-a-simple-statement-i-have-a-choice/
391,8,/r/worldnews,"Hong Kong real estate now more expensive for the dead than the living - A tiny nook for an urn can cost up to £180,000. With 200,000 sets of ashes waiting for a resting place, the city is running out of options",https://www.theguardian.com/cities/2019/apr/23/dead-pricey-hong-kong-burial-plots-now-more-expensive-than-living-space
392,6,/r/worldnews,"China warned Tuesday that the US decision to impose sanctions on buyers of Iranian oil will ""intensify turmoil"" in the Middle East and in the international energy market",https://www.france24.com/en/20190423-us-sanctions-over-iran-oil-will-intensify-mideast-turmoil-china
393,0,/r/worldnews,"I will name a Golan town after Trump, says Israel's Netanyahu",https://www.bbc.com/news/world-middle-east-48031045
394,3,/r/worldnews,"Eurozone consumer confidence fell unexpectedly by 0.7 points in April from the March number, figures released on Tuesday showed.",https://www.cnbc.com/2019/04/23/euro-zone-consumer-confidence-falls-unexpectedly-in-april.html
395,1,/r/worldnews,At least 264 dead in battle for Libya capital: WHO,https://www.channelnewsasia.com/news/world/at-least-264-dead-in-battle-for-libya-capital--who-11471928
396,2024,/r/worldnews,Mueller Confirms: Don Jr. Was Too Stupid to Collude.,https://www.vanityfair.com/news/2019/04/mueller-report-confirms-don-jr-too-stupid-to-collude-with-russia
397,8,/r/worldnews,Germany's AfD invites ex-Trump advisor Steve Bannon to conference,https://www.thelocal.de/20190423/germanys-afd-invites-former-trump-advisor-steve-bannon-to-conference
398,4,/r/worldnews,Hackers Can Tell What Netflix Bandersnatch Choices You Make,https://www.wired.com/story/netflix-interactive-bandersnatch-hackers-choices/
399,4,/r/worldnews,North Macedonia on knife-edge as indecisive election goes to runoff,https://www.theguardian.com/world/2019/apr/22/north-macedonia-presidential-election-goes-to-runoff-as-name-change-divides
400,5,/r/worldnews,Brexit insurgency threatens Theresa May’s revised plan and her leadership,https://www.euronews.com/2019/04/23/brexit-insurgency-threatens-theresa-may-s-revised-plan-and-her-leadership
401,5,/r/worldnews,Fire-damaged Notre-Dame faces a new threat: rain,https://www.bbc.com/news/world-europe-48022661
402,358,/r/worldnews,EU votes to create gigantic biometrics database,https://www.zdnet.com/article/eu-votes-to-create-gigantic-biometrics-database/
403,2,/r/worldnews,Russia tightens grip over grain exports with state-led association,https://uk.reuters.com/article/russia-grains-exports/update-2-russia-tightens-grip-over-grain-exports-with-state-led-association-idUKL5N225151
404,5,/r/worldnews,Hundreds evacuated after Sydney Opera House gas leak,https://www.9news.com.au/national/sydney-news-fire-crews-responding-to-gas-leak-at-sydney-opera-house/c4c06b53-49e8-42d3-9933-a8f3c36bea59
405,31,/r/worldnews,Mexico's Foreign Ministry slams 'useless' U.S. border delays,https://www.reuters.com/article/us-mexico-politics-usa/mexicos-foreign-ministry-slams-useless-u-s-border-delays-idUSKCN1RZ040?feedType=RSS&feedName=politicsNews&utm_source=feedburner&utm_medium=feed&utm_campaign=Feed%3A+Reuters%2FPoliticsNews+%28Reuters+Politics+News%29
406,12,/r/worldnews,Hundreds evacuated after gas leak near Sydney Opera House,https://www.smh.com.au/national/nsw/hundreds-evacuated-after-gas-leak-near-sydney-opera-house-20190423-p51gkr.html
407,1,/r/worldnews,Greek PM's criticism takes shine off Weber's push for EU's top job,https://www.theguardian.com/world/2019/apr/23/manfred-weber-campaign-launch-athens-greece-prime-minister-alexis-tsipras
408,6,/r/worldnews,Myanmar's top court rejects final appeal by jailed Reuters journalists,https://in.reuters.com/article/myanmar-journalists/myanmars-top-court-rejects-final-appeal-by-jailed-reuters-journalists-idINKCN1RZ06Q
409,0,/r/worldnews,Pakistani policeman assigned to escort polio workers killed,https://www.660citynews.com/2019/04/23/pakistani-policeman-assigned-to-escort-polio-workers-killed/
410,136,/r/worldnews,Thousands call for release of jailed activists: Huge crowds have rallied in the Moroccan capital to demand the release of activists who staged mass anti-poverty demonstrations in 2016,https://www.dw.com/en/morocco-thousands-call-for-release-of-jailed-activists/a-48429157
411,29,/r/worldnews,Iran Threatens to Close Strait of Hormuz in Showdown with US,https://www.bloomberg.com/news/articles/2019-04-22/iran-will-close-strait-of-hormuz-if-it-can-t-use-it-fars
412,418,/r/worldnews,Sri Lankan health minister says domestic militant group suspected for deadly Easter bombings,http://time.com/5575145/sri-lanka-domestic-militant-group-national-thowfeek-jamaath/
413,2,/r/worldnews,"U.S. accuses pair of stealing secrets, spying on GE to aid China",https://finance.yahoo.com/news/u-accuses-pair-china-stealing-183637242.html
414,11,/r/worldnews,6.2-magnitude quake hits central Philippines less than 24 hours after northern Philippines was struck with a 6.1 quake,https://news.abs-cbn.com/news/04/23/19/62-magnitude-quake-hits-eastern-samar
415,504,/r/worldnews,Canadian researchers warn of 'cascading impacts' as bumblebee species decline - York University researchers say the American bumblebee is facing imminent extinction from Canada,https://www.cbc.ca/news/canada/toronto/bumblebees-decline-pollinators-1.5106260
416,631,/r/worldnews,"In Kerala, homeless move into own flats. The seven-storey 271-unit complex has 3 rooms, 24-hr security, health sub-centre in compound and is free of cost. From daily wage workers to the homeless, over 170 families have moved in so far, and the rest are expected to follow in the coming weeks",https://indianexpress.com/article/india/in-kerala-homeless-move-into-own-flats-5687483/
417,28,/r/worldnews,Climate change is already exacerbating global economic inequality,https://thinkprogress.org/climate-change-is-already-exacerbating-global-economic-inequality-ad2c18714a3f/
418,40,/r/worldnews,"Ontarians Fight Back Against Province's Cuts To Library Services: Doug Ford's Progressive Conservative government axed funding for the Southern Ontario Library Service (SOLS) and the Ontario Library Service-North (OLSN), cutting their budgets in half for the 2019-2020 fiscal year.",https://www.huffingtonpost.ca/2019/04/21/ontario-library-cuts_a_23715110/?utm_hp_ref=ca-homepage&ncid=other_homepage_tiwdkz83gze&utm_campaign=mw_entry_recirc
419,31077,/r/worldnews,Sri Lankan police issued an intelligence alert warning that terrorists planned to hit ‘prominent churches’ 10 days before Easter bombings,https://www.thisisinsider.com/sri-lankan-police-issued-alert-10-days-before-suicide-bomber-attack-2019-4
420,4,/r/worldnews,"Saudi Arabia welcomes U.S. move to end all Iran sanction waivers to ban Iranian oil revenues to zero, says it's a necessary step to halt Iran’s “destabilizing” policy in the region",https://www.reuters.com/article/us-usa-iran-sanctions-saudi/saudi-arabia-welcomes-u-s-move-to-end-all-iran-sanction-waivers-idUSKCN1RZ0PU
421,6,/r/worldnews,Iran parliament authorises firm action against US 'terrorist' acts,https://www.dawn.com/news/1477915/iran-parliament-authorises-firm-action-against-us-terrorist-acts
422,12,/r/worldnews,"Carlsberg Admits That Their Beer Tastes Like ‘Piss,’ Hence Revamped It",https://stillunfold.com/miscellaneous/carlsberg-admits-that-their-beer-tastes-like-piss-hence-revamped-it
423,5,/r/worldnews,AP News: N Ireland: Woman arrested in slaying of journalist McKee,https://apnews.com/b29150dd0572485591e1a6dc081bd38c
424,95,/r/worldnews,Iran threatens to close Strait of Hormuz after US ends sanction waivers,https://www.timesofisrael.com/iran-threatens-to-close-strait-of-hormuz-after-us-ends-sanction-waivers/
425,2,/r/worldnews,Greta Thunberg condemns UK's climate stance in speech to MPs - Teenager who sparked global youth movement hits out at airport expansion and support for fossil fuels,https://www.theguardian.com/environment/2019/apr/23/vacant-seat-for-may-as-party-leaders-meet-greta-thunberg
426,4,/r/worldnews,Former Marine connected to North Korea embassy raid to appear in federal court,https://www.reuters.com/article/us-spain-northkorea-usa/former-marine-connected-to-north-korea-embassy-raid-to-appear-in-federal-court-idUSKCN1RZ0X2
427,1,/r/worldnews,"A student is suing Apple Inc for $1bn, claiming that its in-store AI led to his mistaken arrest.",https://www.bbc.com/news/technology-48022890
428,2,/r/worldnews,Politician from Hitler's home town resigns over 'deeply racist' poem,https://www.theguardian.com/world/2019/apr/23/politician-from-hitlers-home-town-resigns-over-deeply-racist-poem
429,2,/r/worldnews,Unidentified gunmen shot dead policeman escorting polio team in Pakistan,https://www.business-standard.com/article/pti-stories/unidentified-gunmen-shot-dead-policeman-escorting-polio-team-in-pak-119042300391_1.html
430,10,/r/worldnews,Myanmar top court denies reporters' appeal,https://www.bbc.com/news/world-asia-48019192
431,28,/r/worldnews,Polish church condemns beating of Jewish effigy in Poland,https://www.apnews.com/2499a84a203e4960b9a64cc049cf5b26
432,2,/r/worldnews,India Prepared to Meet Oil Demand Without Iranian Oil - Energy Minister,https://sputniknews.com/asia/201904231074374273-india-prepared-tomeet-oil-demands/
433,11,/r/worldnews,Lyra McKee killing: 'New IRA admits responsibility',https://www.bbc.com/news/uk-48018615
434,268,/r/worldnews,"China's new gaming rules ban blood, gambling and games based on the Chinese imperial past",https://china-underground.com/2019/04/22/china-gaming-rules/
435,0,/r/worldnews,Rosneft helps Venezuela evade US sanctions? Reuters amends story as firm vows to get agency banned,https://www.rt.com/news/457365-reuters-rosneft-venezuela-allegations/
436,3,/r/worldnews,French presidential candidate to face trial over fake jobs scandal,https://www.reuters.com/article/us-france-politics-fillon/french-presidential-candidate-to-face-trial-over-fake-jobs-scandal-idUSKCN1RZ0UX
437,0,/r/worldnews,Protest train arrives in Khartoum to join demonstration,https://news.yahoo.com/protest-train-arrives-khartoum-join-demonstration-164242541.html
438,154,/r/worldnews,Oil jumps to nearly 6-month high after the Trump administration announces plans to send Iranian exports to zero,https://markets.businessinsider.com/commodities/news/oil-price-trump-administration-plans-send-iranian-exports-zero-2019-4-1028126621
439,2,/r/worldnews,Israel to name new town on Golan after Trump: Netanyahu,https://www.reuters.com/article/us-israel-usa-golan/israel-to-name-new-town-on-golan-after-trump-netanyahu-idUSKCN1RZ1QQ?il=0
440,115,/r/worldnews,Bomb explodes as police attempt to diffuse it near St. Anthony’s Church in Kochchikade,https://www.euronews.com/2019/04/21/explosions-hit-two-sri-lankan-churches-two-hotels-at-easter-police
441,46,/r/worldnews,Extinction Rebellion protesters stage 'die-in' at Natural History Museum,https://www.telegraph.co.uk/news/2019/04/22/climate-protesters-stage-die-in-natural-history-museum-demonstrations/amp/
442,3,/r/worldnews,Easter Sunday bombings were retaliation against New Zealand mosque attack - Minister,https://www.radionz.co.nz/news/world/387624/easter-sunday-bombings-were-retaliation-against-new-zealand-mosque-attack-minister
443,7,/r/worldnews,"In Notre-Dame's shadow, a 'village' faces uncertain future",https://www.thejakartapost.com/travel/2019/04/21/in-notre-dames-shadow-a-village-faces-uncertain-future.html
444,6,/r/worldnews,"Explosions in Tripoli suburb after air raid, death toll rises",https://www.aljazeera.com/news/2019/04/explosions-tripoli-suburb-air-strike-death-toll-rises-190421090926733.html
445,27,/r/worldnews,U.S. offering $10 million for info on Hezbollah's financial mechanisms,https://www.jpost.com/Middle-East/US-offering-10-million-for-info-on-Hezbollahs-financial-mechanisms-587629
446,10,/r/worldnews,Oil near 2019 highs after the US ends all Iran sanction exemptions.,https://www.cnbc.com/2019/04/23/oil-market-us-iran-sanction-waivers-opec-supply-cuts-in-focus.html
447,105,/r/worldnews,"Boris Johnson suggests his climate change opinions are as important as young people's because 'I intend to be alive for a very long time' - Former foreign secretary criticises 'smug, irritating and disruptive' activists as Extinction Rebellion protest continues",https://www.independent.co.uk/news/uk/politics/boris-johnson-extinction-rebellion-climate-change-protests-arrests-a8881176.html
448,0,/r/worldnews,"Volker supports conducting direct talks between Zelensky, Putin",http://www.cityfalcon.com/watchlists?assets=ukrainian+elections&filter=top&time=week1&languages=en&utm_campaign=ao_reddit
449,24,/r/worldnews,"Indian, Australian warships arrive in China for naval parade | Article [AMP] | Reuters",https://www.reuters.com/article/us-china-military-anniversary-idUSKCN1RX04W
450,51,/r/worldnews,Sri Lankan military given sweeping powers after bombings,https://apnews.com/4cd638f46eb04906819be649163185b7
451,3,/r/worldnews,No to ‘unilateral sanctions’: Turkey slams US for ending waivers on Iranian oil imports,https://www.rt.com/news/457254-turkey-slam-us-iran-oil/
452,101,/r/worldnews,A father and son who were volunteer lifesavers have drowned while trying to rescue a tourist swept out to sea off the Australian state of Victoria,https://www.bbc.co.uk/news/world-australia-48015753
453,45869,/r/worldnews,Notre Dame fire pledges inflame yellow vest protesters. Demonstrators criticise donations by billionaires to restore burned cathedral as they march against economic inequality.,https://www.aljazeera.com/news/2019/04/notre-dame-fire-pledges-inflame-yellow-vest-protesters-190420171251402.html
454,14,/r/worldnews,Japan sees limited impact from U.S. decision on Iran sanctions: minister,https://www.reuters.com/article/us-usa-iran-oil-japan/japan-sees-limited-impact-from-u-s-decision-on-iran-sanctions-minister-idUSKCN1RZ024
455,125,/r/worldnews,Trump administration announces all countries importing Iranian oil will be subject to US sanctions,https://www.cnn.com/2019/04/22/politics/trump-administration-iranian-oil-sanction-waiver/index.html
456,1,/r/worldnews,Saudi Arabia executes 37 terrorists in 6 cities for planning attacks,https://www.khaleejtimes.com/region/saudi-arabia/saudi-arabia-executes-37-terrorists-in-5-cities-for-planning-attacks
457,0,/r/worldnews,Netanyahu: 'I will name a Golan town after Trump',https://www.jpost.com/Breaking-News/Netanyahu-I-will-name-a-Golan-town-after-Trump-587690
